TrackTitle,TrackDescription,FileName,Keywords,MediaCode,TrackTime,TrackCD,TrackTrack,TrackIndex,
CAN OPENER MANUAL,LARGE JUICE TIN PUNCTURE OPEN,CanOpenerManual 6020_19_3,Small Household Appliances,6020-19-03,:01,6020,19,3,
CAN OPENER MANUAL,REMOVE LID WITH MANUAL CAN OPENER,CanOpenerManual 6020_20,Small Household Appliances,6020-20-01,:20,6020,20,1,
CAN BEER,OPEN BEER CAN,CanBeer 6020_22_1,Food,6020-22-01,:02,6020,22,1,
CAN BEER,OPEN BEER CAN,CanBeer 6020_22_2,Food,6020-22-02,:02,6020,22,2,
CAN BEER,OPEN BEER CAN,CanBeer 6020_22_3,Food,6020-22-03,:02,6020,22,3,
CAN BEER,POUR INTO GLASS AND FIZZ,CanBeer 6020_23_1,Food,6020-23-01,:15,6020,23,1,
CAN BEER,POUR INTO GLASS AND FIZZ,CanBeer 6020_23_2,Food,6020-23-02,:12,6020,23,2,
CAN CRUSH,CRUSH TIN CAN METAL,CanCrush 6020_24_1,Food,6020-24-01,:02,6020,24,1,
CAN CRUSH,CRUSH TIN CAN METAL,CanCrush 6020_24_2,Food,6020-24-02,:01,6020,24,2,
CAN CRUSH,FOLD TIN CAN METAL,CanCrush 6020_24_3,Food,6020-24-03,:01,6020,24,3,
CAN CRUSH,STOMP ON TIN CAN METAL,CanCrush 6020_25_1,Metal Impacts,6020-25-01,:01,6020,25,1,
CAN CRUSH,STOMP ON TIN CAN METAL,CanCrush 6020_25_2,Metal Impacts,6020-25-02,:01,6020,25,2,
CAN CRUSH,STOMP ON TIN CAN METAL,CanCrush 6020_25_3,Metal Impacts,6020-25-03,:01,6020,25,3,
CAN FALL,TIN CAN FALL ON CONCRETE METAL,CanFall 6020_26_1,Metal Impacts,6020-26-01,:02,6020,26,1,
CAN FALL,TIN CAN FALL ON CONCRETE METAL,CanFall 6020_26_2,Metal Impacts,6020-26-02,:05,6020,26,2,
CAN FALL,TIN CAN FALL ON CONCRETE METAL,CanFall 6020_26_3,Metal Impacts,6020-26-03,:03,6020,26,3,
CAN FALL,TIN CAN FALL ON CONCRETE METAL,CanFall 6020_26_4,Metal Impacts,6020-26-04,:03,6020,26,4,
CAN FALL,TIN CAN FALL ON WOOD FLOOR METAL,CanFall 6020_27_1,Metal Impacts,6020-27-01,:03,6020,27,1,
CAN FALL,TIN CAN FALL ON WOOD FLOOR METAL,CanFall 6020_27_2,Metal Impacts,6020-27-02,:03,6020,27,2,
CAN FALL,TIN CAN FALL ON WOOD FLOOR METAL,CanFall 6020_27_3,Metal Impacts,6020-27-03,:05,6020,27,3,
CAN JUICE,POUR INTO GLASS FROM LARGE JUICE TIN FAST,CanJuice 6020_28_1,Food,6020-28-01,:11,6020,28,1,
CAN JUICE,POUR INTO GLASS FROM LARGE JUICE TIN SLOW,CanJuice 6020_28_2,Food,6020-28-02,:23,6020,28,2,
CAN METAL TIN,PULL LID OFF LARGE METAL TIN,CanMetalTin 6020_29_1,Metal Containers Lids & Grates,6020-29-01,:02,6020,29,1,
CAN METAL TIN,REPLACE LID ON LARGE METAL TIN,CanMetalTin 6020_29_2,Metal Containers Lids & Grates,6020-29-02,:03,6020,29,2,
CAN METAL TIN,REPLACE LID ON LARGE METAL TIN,CanMetalTin 6020_29_3,Metal Containers Lids & Grates,6020-29-03,:05,6020,29,3,
CAN SHAKE,SHAKE LARGE FULL TIN,CanShake 6020_30,Metal Foley;Crackle Rattle & Jingle Foley,6020-30-01,:04,6020,30,1,
CAN SOFT DRINK,OPEN SOFT DRINK CAN SODA,CanSoftDrink 6020_31_1,Plastic Boxes & Containers;Kitchen & Dining Room,6020-31-01,:01,6020,31,1,
CAN SOFT DRINK,OPEN SOFT DRINK CAN SODA,CanSoftDrink 6020_31_2,Plastic Boxes & Containers;Kitchen & Dining Room,6020-31-02,:02,6020,31,2,
CAN SOFT DRINK,OPEN SOFT DRINK CAN AND FIZZ SODA,CanSoftDrink 6020_31_3,Plastic Boxes & Containers;Kitchen & Dining Room,6020-31-03,:20,6020,31,3,
CAN SOFT DRINK,POUR INTO GLASS AND FIZZ SODA,CanSoftDrink 6020_32_1,Plastic Boxes & Containers;Kitchen & Dining Room,6020-32-01,:38,6020,32,1,
CAN SOFT DRINK,POUR INTO GLASS AND FIZZ SODA,CanSoftDrink 6020_32_2,Plastic Boxes & Containers;Kitchen & Dining Room,6020-32-02,:24,6020,32,2,
CAN SPRAY,REMOVE LID FROM AEROSOL CAN,CanSpray 6020_33_1,Metal Containers Lids & Grates,6020-33-01,:01,6020,33,1,
CAN SPRAY,REMOVE LID FROM AEROSOL CAN,CanSpray 6020_33_2,Metal Containers Lids & Grates,6020-33-02,:01,6020,33,2,
CAN SPRAY,REPLACE LID ON AEROSOL CAN,CanSpray 6020_33_3,Metal Containers Lids & Grates,6020-33-03,:01,6020,33,3,
CAN SPRAY,REPLACE LID ON AEROSOL CAN,CanSpray 6020_33_4,Metal Containers Lids & Grates,6020-33-04,:01,6020,33,4,
CAN SPRAY,REPLACE LID AND SLAP ON AEROSOL CAN,CanSpray 6020_33_5,Metal Containers Lids & Grates,6020-33-05,:02,6020,33,5,
CAN SPRAY,SHAKE SMALL SPRAY CAN WITH BALL BEARING SHORT,CanSpray 6020_34_1,Metal Foley;Crackle Rattle & Jingle Foley,6020-34-01,:03,6020,34,1,
CAN SPRAY,SHAKE SMALL SPRAY CAN WITH BALL BEARING LONG,CanSpray 6020_34_2,Metal Foley;Crackle Rattle & Jingle Foley,6020-34-02,:16,6020,34,2,
CAN SPRAY,SHAKE LARGE SPRAY CAN WITH BALL BEARING SHORT,CanSpray 6020_34_3,Metal Foley;Crackle Rattle & Jingle Foley,6020-34-03,:06,6020,34,3,
CAN SPRAY,SHAKE LARGE SPRAY CAN WITH BALL BEARING LONG,CanSpray 6020_34_4,Metal Foley;Crackle Rattle & Jingle Foley,6020-34-04,:12,6020,34,4,
CAN SPRAY,SHORT SPRAY,CanSpray 6020_35_1,Cleaning;Air Gases & Steam,6020-35-01,:02,6020,35,1,
CAN SPRAY,SHORT SPRAY,CanSpray 6020_35_2,Cleaning;Air Gases & Steam,6020-35-02,:03,6020,35,2,
CAN SPRAY,LONG SPRAY,CanSpray 6020_35_3,Cleaning;Air Gases & Steam,6020-35-03,:08,6020,35,3,
CAN SPRAY,LONG SPRAY,CanSpray 6020_35_4,Cleaning;Air Gases & Steam,6020-35-04,:07,6020,35,4,
CAN SPRAY,SPRAY POLISH ON TO TABLE,CanSpray 6020_35_5,Cleaning;Air Gases & Steam,6020-35-05,:04,6020,35,5,
CANNON,BLACK POWDER CANNON: SINGLE BLAST,GunCannon 6025_32_1,Cannons,6025-32-01,:05,6025,32,1,
CANNON,BLACK POWDER CANNON: SINGLE BLAST,GunCannon 6025_32_2,Cannons,6025-32-02,:09,6025,32,2,
CANOE PADDLE,LIGHT PADDLING IN CANOE MARINE,BoatCanoePaddle 6024_64,Canoes & Kayaks,6024-64-01,:29,6024,64,1,
CANOE PADDLE,LIGHT PADDLING IN CANOE MARINE,BoatCanoePaddle 6024_65,Canoes & Kayaks,6024-65-01,1:00,6024,65,1,
CANOE PADDLE,FAST PADDLING SIMULATED MARINE,BoatCanoePaddle 6024_66,Canoes & Kayaks,6024-66-01,:25,6024,66,1,
CANOE PADDLE,SINGLE PADDLE STROKE IN CANOE MARINE,BoatCanoePaddle 6024_67_1,Canoes & Kayaks,6024-67-01,:05,6024,67,1,
CANOE PADDLE,SINGLE PADDLE STROKE FOLEY MARINE,BoatCanoePaddle 6024_67_2,Canoes & Kayaks,6024-67-02,:06,6024,67,2,
CAR WASH,INTERNAL: CAR GOING THROUGH AUTOMATIC CAR WASH AUTO,CarWash 6004_97,Factory & Industrial Equipment,6004-97-01,3:06,6004,97,1,
CAR WASH,EXTERNAL: SPRAYING CAR IN MANUAL CAR WASH AUTO,CarWash 6004_98,Factory & Industrial Equipment,6004-98-01,1:34,6004,98,1,
CAR WASH,INTERNAL: SPRAYING CAR IN MANUAL CAR WASH AUTO,CarWash 6004_99,Factory & Industrial Equipment,6004-99-01,1:12,6004,99,1,
CARDS,SINGLE SHUFFLE GAMBLING CASINO,Cards 6010_55_1,Gambling Equipment & Cards,6010-55-01,:01,6010,55,1,
CARDS,SINGLE SHUFFLE GAMBLING CASINO,Cards 6010_55_2,Gambling Equipment & Cards,6010-55-02,:03,6010,55,2,
CARDS,SINGLE SHUFFLE GAMBLING CASINO,Cards 6010_55_3,Gambling Equipment & Cards,6010-55-03,:07,6010,55,3,
CARDS,FLIP THROUGH DECK SLOW GAMBLING CASINO,Cards 6010_55_4,Gambling Equipment & Cards,6010-55-04,:02,6010,55,4,
CARDS,FLIP THROUGH DECK FAST GAMBLING CASINO,Cards 6010_55_5,Gambling Equipment & Cards,6010-55-05,:01,6010,55,5,
CARDS,FLIP THROUGH DECK VERY FAST GAMBLING CASINO,Cards 6010_55_6,Gambling Equipment & Cards,6010-55-06,:01,6010,55,6,
CARDS,FLIP DECK FROM ONE HAND TO THE OTHER GAMBLING CASINO,Cards 6010_55_7,Gambling Equipment & Cards,6010-55-07,:01,6010,55,7,
CARDS,SLAP TWO HALVES OF DECK TOGETHER AFTER CUT GAMBLING CASINO,Cards 6010_55_8,Gambling Equipment & Cards,6010-55-08,:01,6010,55,8,
CARDS,SLAP DECK ON TABLE GAMBLING CASINO,Cards 6010_55_9,Gambling Equipment & Cards,6010-55-09,:03,6010,55,9,
CARDS,DEAL SINGLE CARD FROM HAND GAMBLING CASINO,Cards 6010_56_1,Gambling Equipment & Cards,6010-56-01,:02,6010,56,1,
CARDS,DEAL CARDS FROM HAND GAMBLING CASINO,Cards 6010_56_2,Gambling Equipment & Cards,6010-56-02,:10,6010,56,2,
CARDS,DEAL SINGLE CARD FROM SHOE GAMBLING CASINO,Cards 6010_56_3,Gambling Equipment & Cards,6010-56-03,:01,6010,56,3,
CARDS,DEAL SINGLE CARD FROM SHOE GAMBLING CASINO,Cards 6010_56_4,Gambling Equipment & Cards,6010-56-04,:01,6010,56,4,
CARDS,DEAL CARDS FROM SHOE GAMBLING CASINO,Cards 6010_56_5,Gambling Equipment & Cards,6010-56-05,:10,6010,56,5,
CARDS,FLIP OVER SINGLE CARD GAMBLING CASINO,Cards 6010_56_6,Gambling Equipment & Cards,6010-56-06,:01,6010,56,6,
CARDS,PLAY SINGLE CARD FROM HAND GAMBLING CASINO,Cards 6010_56_7,Gambling Equipment & Cards,6010-56-07,:03,6010,56,7,
CARDS,HANDLE SINGLE CARD GAMBLING CASINO,Cards 6010_56_8,Gambling Equipment & Cards,6010-56-08,:02,6010,56,8,
CART DELIVERY,PUSH AWAY LARGE CART IN WAREHOUSE,CartDelivery 6010_57_1,Roll & Spin Foley,6010-57-01,:14,6010,57,1,
CART DELIVERY,PUSH UP LARGE CART IN WAREHOUSE,CartDelivery 6010_57_2,Roll & Spin Foley,6010-57-02,:12,6010,57,2,
CART DELIVERY,PUSH LARGE CART BY IN WAREHOUSE,CartDelivery 6010_57_3,Roll & Spin Foley,6010-57-03,:20,6010,57,3,
CART SHOPPING,PUSH AWAY SHOPPING CART DOWN STORE AISLE GROCERY,CartShopping 6010_58_1,Roll & Spin Foley,6010-58-01,:16,6010,58,1,
CART SHOPPING,PUSH UP SHOPPING CART IN STORE AISLE GROCERY,CartShopping 6010_58_2,Roll & Spin Foley,6010-58-02,:17,6010,58,2,
CART SHOPPING,PUSH SHOPPING CART BY IN STORE AISLE GROCERY,CartShopping 6010_58_3,Roll & Spin Foley,6010-58-03,:17,6010,58,3,
CASE HANDLE,PICK UP HANDLE ON LARGE CASE LUGGAGE SUITCASE,CaseHandle 6010_59_1,Miscellaneous Opens & Closes,6010-59-01,:02,6010,59,1,
CASE HANDLE,DROP HANDLE ON LARGE CASE LUGGAGE SUITCASE,CaseHandle 6010_59_2,Miscellaneous Opens & Closes,6010-59-02,:02,6010,59,2,
CASE LATCH,SMALL CLASP ON SUITCASE: POP OPEN LUGGAGE,CaseLatch 6010_59_3,Miscellaneous Opens & Closes,6010-59-03,:01,6010,59,3,
CASE LATCH,SMALL CLASP ON SUITCASE: SNAP CLOSED LUGGAGE,CaseLatch 6010_59_4,Miscellaneous Opens & Closes,6010-59-04,:01,6010,59,4,
CASE LATCH,SMALL CLASP ON SUITCASE: UNFASTEN LUGGAGE,CaseLatch 6010_59_5,Miscellaneous Opens & Closes,6010-59-05,:02,6010,59,5,
CASE LATCH,SMALL CLASP ON SUITCASE: FASTEN LUGGAGE,CaseLatch 6010_59_6,Miscellaneous Opens & Closes,6010-59-06,:02,6010,59,6,
CASE LATCH,LARGE CLASP ON FLIGHT CASE: UNFASTEN LUGGAGE SUITCASE,CaseLatch 6010_60_1,Miscellaneous Opens & Closes,6010-60-01,:03,6010,60,1,
CASE LATCH,LARGE CLASP ON FLIGHT CASE: FASTEN LUGGAGE SUITCASE,CaseLatch 6010_60_2,Miscellaneous Opens & Closes,6010-60-02,:03,6010,60,2,
CASE LATCH,LARGE CLASP ON FLIGHT CASE: UNFASTEN TWO CLASPS LUGGAGE SUITCASE,CaseLatch 6010_60_3,Miscellaneous Opens & Closes,6010-60-03,:04,6010,60,3,
CASE LATCH,LARGE CLASP ON FLIGHT CASE: FASTEN TWO CLASPS LUGGAGE SUITCASE,CaseLatch 6010_60_4,Miscellaneous Opens & Closes,6010-60-04,:03,6010,60,4,
CASE LUGGAGE,UNLOCK SINGLE LATCH SUITCASE,CaseLuggage 6010_61_1,Luggage & Cases,6010-61-01,:02,6010,61,1,
CASE LUGGAGE,LOCK SINGLE LATCH SUITCASE,CaseLuggage 6010_61_2,Luggage & Cases,6010-61-02,:03,6010,61,2,
CASE LUGGAGE,UNLOCK BOTH LATCHES SUITCASE,CaseLuggage 6010_61_3,Luggage & Cases,6010-61-03,:03,6010,61,3,
CASE LUGGAGE,LOCK BOTH LATCHES SUITCASE,CaseLuggage 6010_61_4,Luggage & Cases,6010-61-04,:03,6010,61,4,
CASE LUGGAGE,UNLOCK LATCHES AND OPEN LID SUITCASE,CaseLuggage 6010_61_5,Luggage & Cases,6010-61-05,:04,6010,61,5,
CASE LUGGAGE,CLOSE LID AND LOCK LATCHES SUITCASE,CaseLuggage 6010_61_6,Luggage & Cases,6010-61-06,:04,6010,61,6,
CASE LUGGAGE,SLAM LID CLOSED AND LOCK LATCHES SUITCASE,CaseLuggage 6010_61_7,Luggage & Cases,6010-61-07,:03,6010,61,7,
CASE LUGGAGE,POP OPEN SINGLE LATCH SUITCASE,CaseLuggage 6010_62_1,Luggage & Cases,6010-62-01,:01,6010,62,1,
CASE LUGGAGE,SNAP CLOSED SINGLE LATCH SUITCASE,CaseLuggage 6010_62_2,Luggage & Cases,6010-62-02,:01,6010,62,2,
CASE LUGGAGE,POP OPEN BOTH LATCHES SUITCASE,CaseLuggage 6010_62_3,Luggage & Cases,6010-62-03,:01,6010,62,3,
CASE LUGGAGE,SNAP CLOSED BOTH LATCHES SUITCASE,CaseLuggage 6010_62_4,Luggage & Cases,6010-62-04,:01,6010,62,4,
CASE LUGGAGE,POP OPEN LATCHES AND OPEN LID SUITCASE,CaseLuggage 6010_62_5,Luggage & Cases,6010-62-05,:03,6010,62,5,
CASE LUGGAGE,CLOSE LID AND SNAP LATCHES CLOSED SUITCASE,CaseLuggage 6010_62_6,Luggage & Cases,6010-62-06,:03,6010,62,6,
CASE LUGGAGE,SLAM LID CLOSED AND SNAP LATCHES CLOSED SUITCASE,CaseLuggage 6010_62_7,Luggage & Cases,6010-62-07,:02,6010,62,7,
CASE PLASTIC,UNFASTEN SINGLE CLASP: SLOW LUGGAGE SUITCASE,CasePlastic 6010_63_1,Luggage & Cases,6010-63-01,:01,6010,63,1,
CASE PLASTIC,UNFASTEN SINGLE CLASP: FAST LUGGAGE SUITCASE,CasePlastic 6010_63_2,Luggage & Cases,6010-63-02,:01,6010,63,2,
CASE PLASTIC,FASTEN SINGLE CLASP: SLOW LUGGAGE SUITCASE,CasePlastic 6010_63_3,Luggage & Cases,6010-63-03,:01,6010,63,3,
CASE PLASTIC,FASTEN SINGLE CLASP: FAST LUGGAGE SUITCASE,CasePlastic 6010_63_4,Luggage & Cases,6010-63-04,:01,6010,63,4,
CASE PLASTIC,POP OPEN CLASP LUGGAGE SUITCASE,CasePlastic 6010_63_5,Luggage & Cases,6010-63-05,:01,6010,63,5,
CASE PLASTIC,SNAP CLASP CLOSED LUGGAGE SUITCASE,CasePlastic 6010_63_6,Luggage & Cases,6010-63-06,:01,6010,63,6,
CASE PLASTIC,OPEN LID LUGGAGE SUITCASE,CasePlastic 6010_63_7,Luggage & Cases,6010-63-07,:02,6010,63,7,
CASE PLASTIC,CLOSE LID LUGGAGE SUITCASE,CasePlastic 6010_63_8,Luggage & Cases,6010-63-08,:03,6010,63,8,
CASH BOX METAL,OPEN LID,CashBoxMetal 6028_24_1,Metal Containers Lids & Grates,6028-24-01,:03,6028,24,1,
CASH BOX METAL,CLOSE LID,CashBoxMetal 6028_24_2,Metal Containers Lids & Grates,6028-24-02,:01,6028,24,2,
CASH REGISTER,ANTIQUE: SINGLE KEY WITH BELL SLOW,CashRegister 6028_25_1,Cash Registers,6028-25-01,:04,6028,25,1,
CASH REGISTER,ANTIQUE: SINGLE KEY WITH BELL FAST,CashRegister 6028_25_2,Cash Registers,6028-25-02,:04,6028,25,2,
CASH REGISTER,ANTIQUE: SINGLE KEY WITH BELL DRAWER OPEN,CashRegister 6028_25_3,Cash Registers,6028-25-03,:04,6028,25,3,
CASH REGISTER,ANTIQUE: SINGLE KEY DRAWER OPEN,CashRegister 6028_25_4,Cash Registers,6028-25-04,:03,6028,25,4,
CASH REGISTER,ANTIQUE: EMPTY DRAWER CLOSE,CashRegister 6028_25_5,Cash Registers,6028-25-05,:03,6028,25,5,
CASH REGISTER,ANTIQUE: FULL DRAWER CLOSE BILL HOLDERS SNAP DOWN,CashRegister 6028_25_6,Cash Registers,6028-25-06,:03,6028,25,6,
CASH REGISTER,ELECTRIC: SINGLE BUTTON,CashRegister 6028_26_1,Cash Registers,6028-26-01,:01,6028,26,1,
CASH REGISTER,ELECTRIC: SINGLE BUTTON,CashRegister 6028_26_2,Cash Registers,6028-26-02,:01,6028,26,2,
CASH REGISTER,ELECTRIC: TOTAL KEY WITH BELL,CashRegister 6028_26_3,Cash Registers,6028-26-03,:07,6028,26,3,
CASH REGISTER,ELECTRIC: TOTAL KEY WITH BELL DRAWER OPEN,CashRegister 6028_26_4,Cash Registers,6028-26-04,:07,6028,26,4,
CASH REGISTER,ELECTRIC: SINGLE ENTRY TOTAL WITH BELL DRAWER OPEN,CashRegister 6028_26_5,Cash Registers,6028-26-05,:08,6028,26,5,
CASH REGISTER,SINGLE ENTRY CRANK HANDLE DRAWER OPEN,CashRegister 6028_26_6,Cash Registers,6028-26-06,:10,6028,26,6,
CASH REGISTER,ELECTRIC: DRAWER CLOSE,CashRegister 6028_26_7,Cash Registers,6028-26-07,:04,6028,26,7,
CASH REGISTER,ELECTRIC: DRAWER CLOSE BILL HOLDERS SNAP DOWN,CashRegister 6028_26_8,Cash Registers,6028-26-08,:02,6028,26,8,
CASH REGISTER,ELECTRIC: PLUS KEY,CashRegister 6028_27_1,Cash Registers,6028-27-01,:02,6028,27,1,
CASH REGISTER,ELECTRIC: ADD SEVERAL ENTRIES TOTAL DRAWER OPEN,CashRegister 6028_27_2,Cash Registers,6028-27-02,:21,6028,27,2,
CASH REGISTER,ELECTRONIC: SHORT FUNCTION BEEP,CashRegister 6028_28_1,Cash Registers,6028-28-01,:01,6028,28,1,
CASH REGISTER,ELECTRONIC: LONG BEEP,CashRegister 6028_28_2,Cash Registers,6028-28-02,:05,6028,28,2,
CASH REGISTER,ELECTRONIC: SINGLE BUTTON WITH BEEP SHORT,CashRegister 6028_28_3,Cash Registers,6028-28-03,:01,6028,28,3,
CASH REGISTER,ELECTRONIC: SINGLE BUTTON WITH BEEP MEDIUM,CashRegister 6028_28_4,Cash Registers,6028-28-04,:01,6028,28,4,
CASH REGISTER,ELECTRONIC: SINGLE BUTTON WITH BEEP FAST,CashRegister 6028_28_5,Cash Registers,6028-28-05,:01,6028,28,5,
CASH REGISTER,ELECTRONIC: SINGLE BUTTON,CashRegister 6028_28_6,Cash Registers,6028-28-06,:01,6028,28,6,
CASH REGISTER,ELECTRONIC: THREE DIGIT ENTRY PRINT RECEIPT,CashRegister 6028_28_7,Cash Registers,6028-28-07,:06,6028,28,7,
CASH REGISTER,ELECTRONIC: FOUR DIGIT ENTRY PRINT RECEIPT,CashRegister 6028_28_8,Cash Registers,6028-28-08,:05,6028,28,8,
CASH REGISTER,ELECTRONIC: TOTAL BUTTON PRINT RECEIPT DRAWER OPEN,CashRegister 6028_28_9,Cash Registers,6028-28-09,:09,6028,28,9,
CASH REGISTER,ELECTRONIC: HIT NO SALE PRINT RECEIPT DRAWER OPEN,CashRegister 6028_28_10,Cash Registers,6028-28-10,:05,6028,28,10,
CASH REGISTER,ELECTRONIC: TEAR OFF PAPER RECEIPT,CashRegister 6028_28_11,Cash Registers,6028-28-11,:01,6028,28,11,
CASH REGISTER,ELECTRONIC: ADDING SEVERAL ENTRIES TOTAL,CashRegister 6028_29_1,Cash Registers,6028-29-01,:24,6028,29,1,
CASH REGISTER,ELECTRONIC: CLOSE DRAWER,CashRegister 6028_29_2,Cash Registers,6028-29-02,:04,6028,29,2,
CASH REGISTER,ELECTRONIC: CLOSE DRAWER BILL HOLDERS SNAP DOWN,CashRegister 6028_29_3,Cash Registers,6028-29-03,:04,6028,29,3,
CASH BILLS,COUNTING BILLS IN HAND SLOW MONEY,CashBills 6028_23_1,Wood Paper & Cardboard Foley;Rustle & Shuffle Foley,6028-23-01,:05,6028,23,1,
CASH BILLS,COUNTING BILLS IN HAND FAST MONEY,CashBills 6028_23_2,Wood Paper & Cardboard Foley;Rustle & Shuffle Foley,6028-23-02,:04,6028,23,2,
CASH BILLS,COUNTING BILLS ON TABLE SLOW MONEY,CashBills 6028_23_3,Wood Paper & Cardboard Foley;Rustle & Shuffle Foley,6028-23-03,:05,6028,23,3,
CASH BILLS,COUNTING BILLS ON TABLE FAST MONEY,CashBills 6028_23_4,Wood Paper & Cardboard Foley;Rustle & Shuffle Foley,6028-23-04,:04,6028,23,4,
CASH BILLS,ELECTRIC BILL COUNTER: START COUNT BILLS STOP MONEY,CashBills 6010_64,Wood Paper & Cardboard Foley;Rustle & Shuffle Foley,6010-64-01,:08,6010,64,1,
CASH DRAWER,SINGLE BILL HOLDER PULL UP MONEY,CashDrawer 6028_30_1,Cash Registers,6028-30-01,:02,6028,30,1,
CASH DRAWER,SINGLE BILL HOLDER PULL UP MONEY,CashDrawer 6028_30_2,Cash Registers,6028-30-02,:03,6028,30,2,
CASH DRAWER,SEVERAL BILL HOLDERS PULL UP MONEY,CashDrawer 6028_30_3,Cash Registers,6028-30-03,:03,6028,30,3,
CASH DRAWER,SINGLE BILL HOLDER SNAP DOWN MONEY,CashDrawer 6028_30_4,Cash Registers,6028-30-04,:02,6028,30,4,
CASH DRAWER,SINGLE BILL HOLDER SNAP DOWN MONEY,CashDrawer 6028_30_5,Cash Registers,6028-30-05,:02,6028,30,5,
CASH DRAWER,SEVERAL BILL HOLDERS SNAP DOWN MONEY,CashDrawer 6028_30_6,Cash Registers,6028-30-06,:04,6028,30,6,
CASINO,AMBIENCE IN LARGE CASINO GAMBLING,Casino 6010_65,Casinos,6010-65-01,1:30,6010,65,1,
CASINO CHIPS,TOSS SINGLE CHIP INTO POT GAMBLING,CasinoChips 6010_66_1,Gambling Equipment & Cards,6010-66-01,:01,6010,66,1,
CASINO CHIPS,TOSS SINGLE CHIP INTO POT GAMBLING,CasinoChips 6010_66_2,Gambling Equipment & Cards,6010-66-02,:01,6010,66,2,
CASINO CHIPS,TOSS SINGLE CHIP INTO POT GAMBLING,CasinoChips 6010_66_3,Gambling Equipment & Cards,6010-66-03,:01,6010,66,3,
CASINO CHIPS,TOSS A FEW CHIPS INTO POT GAMBLING,CasinoChips 6010_66_4,Gambling Equipment & Cards,6010-66-04,:01,6010,66,4,
CASINO CHIPS,TOSS MANY CHIPS INTO POT GAMBLING,CasinoChips 6010_66_5,Gambling Equipment & Cards,6010-66-05,:01,6010,66,5,
CASINO CHIPS,SEVERAL PLAYERS TOSSING SINGLE CHIPS INTO POT GAMBLING,CasinoChips 6010_66_6,Gambling Equipment & Cards,6010-66-06,:02,6010,66,6,
CASINO CHIPS,SEVERAL PLAYERS TOSSING SEVERAL CHIPS INTO POT GAMBLING,CasinoChips 6010_66_7,Gambling Equipment & Cards,6010-66-07,:02,6010,66,7,
CASINO CHIPS,TOSS LARGE PILE OF CHIPS INTO POT GAMBLING,CasinoChips 6010_66_8,Gambling Equipment & Cards,6010-66-08,:02,6010,66,8,
CASINO CHIPS,RAKE IN SMALL POT GAMBLING,CasinoChips 6010_67_1,Gambling Equipment & Cards,6010-67-01,:02,6010,67,1,
CASINO CHIPS,RAKE IN LARGE POT GAMBLING,CasinoChips 6010_67_2,Gambling Equipment & Cards,6010-67-02,:03,6010,67,2,
CASINO CHIPS,STACKING CHIPS GAMBLING,CasinoChips 6010_67_3,Gambling Equipment & Cards,6010-67-03,:22,6010,67,3,
CASINO CHIPS,SHUFFLE STACK OF CHIPS GAMBLING,CasinoChips 6010_67_4,Gambling Equipment & Cards,6010-67-04,:01,6010,67,4,
CASINO CHIPS,SHUFFLE STACK OF CHIPS GAMBLING,CasinoChips 6010_67_5,Gambling Equipment & Cards,6010-67-05,:01,6010,67,5,
CASINO SLOT MACHINE,BET THREE COINS PULL HANDLE NO WIN GAMBLING,CasinoSlotMachine 6010_68_1,Gambling Equipment & Cards,6010-68-01,:08,6010,68,1,
CASINO SLOT MACHINE,BET THREE COINS PULL HANDLE SMALL PAYOUT GAMBLING,CasinoSlotMachine 6010_68_2,Gambling Equipment & Cards,6010-68-02,:19,6010,68,2,
CASINO SLOT MACHINE,BET THREE COINS PULL HANDLE LARGE PAYOUT GAMBLING,CasinoSlotMachine 6010_68_3,Gambling Equipment & Cards,6010-68-03,:41,6010,68,3,
CASINO SLOT MACHINE,BET THREE COINS PULL HANDLE PAYOUT NO ELECTRONICS GAMBLING,CasinoSlotMachine 6010_68_4,Gambling Equipment & Cards,6010-68-04,:21,6010,68,4,
CASINO SLOT MACHINE,ANTIQUE: BET COIN PULL HANDLE NO WIN GAMBLING,CasinoSlotMachine 6010_69_1,Gambling Equipment & Cards,6010-69-01,:08,6010,69,1,
CASINO SLOT MACHINE,ANTIQUE: BET COIN PULL HANDLE SMALL PAYOUT GAMBLING,CasinoSlotMachine 6010_69_2,Gambling Equipment & Cards,6010-69-02,:16,6010,69,2,
CASINO SLOT MACHINE,ANTIQUE: BET COIN PULL HANDLE LARGE PAYOUT BELL GAMBLING,CasinoSlotMachine 6010_69_3,Gambling Equipment & Cards,6010-69-03,:22,6010,69,3,
CASINO WHEEL,GAMING WHEEL WITH THIN POINTER: LONG SPIN GAMBLING,CasinoWheel 6010_70_1,Gambling Equipment & Cards,6010-70-01,:17,6010,70,1,
CASINO WHEEL,GAMING WHEEL WITH HEAVY WOOD POINTER: LONG SPIN GAMBLING,CasinoWheel 6010_70_2,Gambling Equipment & Cards,6010-70-02,:16,6010,70,2,
CAT,DOMESTIC: SINGLE MEOW ANIMAL,AnimalCat 6003_39_1,Cats - Domestic Cats,6003-39-01,:01,6003,39,1,
CAT,DOMESTIC: SINGLE MEOW ANIMAL,AnimalCat 6003_39_2,Cats - Domestic Cats,6003-39-02,:02,6003,39,2,
CAT,DOMESTIC: SINGLE MEOW ANIMAL,AnimalCat 6003_39_3,Cats - Domestic Cats,6003-39-03,:02,6003,39,3,
CAT,DOMESTIC: SINGLE MEOW ANIMAL,AnimalCat 6003_40_1,Cats - Domestic Cats,6003-40-01,:02,6003,40,1,
CAT,DOMESTIC: SINGLE MEOW ANIMAL,AnimalCat 6003_40_2,Cats - Domestic Cats,6003-40-02,:02,6003,40,2,
CAT,DOMESTIC: MEOWING ANIMAL,AnimalCat 6003_40_3,Cats - Domestic Cats,6003-40-03,:06,6003,40,3,
CAT,DOMESTIC: MEOWING ANIMAL,AnimalCat 6003_41_1,Cats - Domestic Cats,6003-41-01,:05,6003,41,1,
CAT,DOMESTIC: MEOWING ANIMAL,AnimalCat 6003_41_2,Cats - Domestic Cats,6003-41-02,:21,6003,41,2,
CAT,DOMESTIC: PURRING ANIMAL,AnimalCat 6003_41_3,Cats - Domestic Cats,6003-41-03,:24,6003,41,3,
CAT,WILD: GROWL HISSING TWO CATS ANIMAL,AnimalCat 6003_42_1,Cats - Domestic Cats,6003-42-01,:35,6003,42,1,
CAT,WILD: GROWL HISSING TWO CATS ANIMAL,AnimalCat 6003_42_2,Cats - Domestic Cats,6003-42-02,:07,6003,42,2,
CAT,WILD: GROWL HISSING ANIMAL,AnimalCat 6003_42_3,Cats - Domestic Cats,6003-42-03,:14,6003,42,3,
CAT,WILD: GROWL HISSING ANIMAL,AnimalCat 6003_43_1,Cats - Domestic Cats,6003-43-01,:09,6003,43,1,
CAT,WILD: GROWL ANIMAL,AnimalCat 6003_43_2,Cats - Domestic Cats,6003-43-02,:02,6003,43,2,
CAT,WILD: HISS ANIMAL,AnimalCat 6003_43_3,Cats - Domestic Cats,6003-43-03,:02,6003,43,3,
CAT,WILD: HISS ANIMAL,AnimalCat 6003_44_1,Cats - Domestic Cats,6003-44-01,:02,6003,44,1,
CAT,WILD: HISS SWAT ANIMAL,AnimalCat 6003_44_2,Cats - Domestic Cats,6003-44-02,:03,6003,44,2,
CAT,WILD: HISSING GROWL SWAT ANIMAL,AnimalCat 6003_44_3,Cats - Domestic Cats,6003-44-03,:07,6003,44,3,
CAT,WILD: CHASING LEASH ANGRY ANIMAL,AnimalCat 6003_44_4,Cats - Domestic Cats,6003-44-04,:10,6003,44,4,
CATAPULT WHEELS,CATAPULT MOVING ON DIRT ROAD,CatapultWheels 6040_10,Catapults & Trebuchets,6040-10-01,:41,6040,10,1,
CAULKING GUN,CAULKING GUN: PULL BACK PISTON CONSTRUCTION,CaulkingGun 6012_03_1,Other Hand Tools,6012-03-01,:01,6012,3,1,
CAULKING GUN,CAULKING GUN: INSERT CARTRIDGE CONSTRUCTION,CaulkingGun 6012_03_2,Other Hand Tools,6012-03-02,:01,6012,3,2,
CAULKING GUN,CAULKING GUN: PRESS TRIGGER SQUEEZE OUT CONTENTS CONSTRUCTION,CaulkingGun 6012_03_3,Other Hand Tools,6012-03-03,:20,6012,3,3,
CEMENT MIXER,MIXING CEMENT,ConstrCementMixer 6010_71,Heavy & Construction Equipment,6010-71-01,:45,6010,71,1,
CHAIN,PULL CHAIN OVER WOODEN PULLEY,Chain 6010_72_1,Chain Foley,6010-72-01,:17,6010,72,1,
CHAIN,CHAIN RATTLING AND MOVEMENT,Chain 6010_72_2,Chain Foley,6010-72-02,:05,6010,72,2,
CHAIN,CHAIN RATTLING AND MOVEMENT,Chain 6010_72_3,Chain Foley,6010-72-03,:06,6010,72,3,
CHAIN,CHAIN FALLING ON CONCRETE,Chain 6010_72_4,Chain Foley,6010-72-04,:02,6010,72,4,
CHAIN,CHAIN FALLING ON CONCRETE,Chain 6010_72_5,Chain Foley,6010-72-05,:02,6010,72,5,
CHAIN,CHAIN FALLING ON DIRT,Chain 6010_72_6,Chain Foley,6010-72-06,:02,6010,72,6,
CHAIN,CHAIN FALLING ON METAL,Chain 6010_72_7,Chain Foley,6010-72-07,:01,6010,72,7,
CHAIN,CHAIN FALLING ON METAL,Chain 6010_72_8,Chain Foley,6010-72-08,:02,6010,72,8,
CHAINSAW,PULL STARTER SEVERAL TIMES LOGGING,Chainsaw 6010_73_1,Chainsaws,6010-73-01,:07,6010,73,1,
CHAINSAW,PULL STARTER SEVERAL TIMES START RUN STALL LOGGING,Chainsaw 6010_73_2,Chainsaws,6010-73-02,:10,6010,73,2,
CHAINSAW,START RUN MAKE SEVERAL SHORT CUTS SHUT OFF LOGGING,Chainsaw 6010_73_3,Chainsaws,6010-73-03,:47,6010,73,3,
CHAINSAW,START RUN MAKE LONG CUT SHUT OFF LOGGING,Chainsaw 6010_73_4,Chainsaws,6010-73-04,:39,6010,73,4,
CHAINSAW,CUTTING IN DISTANCE LOGGING,Chainsaw 6010_73_5,Chainsaws,6010-73-05,:59,6010,73,5,
CHAIR BARBER SHOP,RAISE WITH FOOT PUMP HAIR SALON,ChairBarberShop 6010_74_1,Desks and Desk Drawers,6010-74-01,:09,6010,74,1,
CHAIR BARBER SHOP,LOWER HAIR SALON,ChairBarberShop 6010_74_2,Desks and Desk Drawers,6010-74-02,:04,6010,74,2,
CHAIR COUCH,SIT DOWN ON COUCH,ChairCouch 6010_75_1,Household Furniture;Office Chairs,6010-75-01,:03,6010,75,1,
CHAIR COUCH,GET UP OFF COUCH,ChairCouch 6010_75_2,Household Furniture;Office Chairs,6010-75-02,:04,6010,75,2,
CHAIR COUCH,MOVEMENT ON COUCH,ChairCouch 6010_75_3,Household Furniture;Office Chairs,6010-75-03,:13,6010,75,3,
CHAIR KITCHEN,SIT DOWN IN KITCHEN CHAIR,ChairKitchen 6010_76_1,Household Furniture,6010-76-01,:03,6010,76,1,
CHAIR KITCHEN,GET UP OUT OF KITCHEN CHAIR,ChairKitchen 6010_76_2,Household Furniture,6010-76-02,:04,6010,76,2,
CHAIR KITCHEN,MOVEMENT IN KITCHEN CHAIR,ChairKitchen 6010_76_3,Household Furniture,6010-76-03,:17,6010,76,3,
CHAIR KITCHEN,SLIDE KITCHEN CHAIR ON HARD FLOOR,ChairKitchen 6010_76_4,Household Furniture,6010-76-04,:02,6010,76,4,
CHAIR KITCHEN,PUT DOWN KITCHEN CHAIR AND SLIDE ON HARD FLOOR,ChairKitchen 6010_76_5,Household Furniture,6010-76-05,:02,6010,76,5,
CHAIR KITCHEN,SCRAPE KITCHEN CHAIR ON HARD FLOOR,ChairKitchen 6010_76_6,Household Furniture,6010-76-06,:03,6010,76,6,
