TrackTitle,TrackDescription,FileName,Keywords,MediaCode,TrackTime,TrackCD,TrackTrack,TrackIndex,
,,,,,,,0,0,
,,,,,,,0,0,
ADDING MACHINE,ANTIQUE: SINGLE BUTTON OFFICE CALCULATOR,AddingMachine 6028_07_1,Adding Machines,6028-07-01,:01,6028,7,1,
ADDING MACHINE,ANTIQUE: SINGLE BUTTON OFFICE CALCULATOR,AddingMachine 6028_07_2,Adding Machines,6028-07-02,:01,6028,7,2,
ADDING MACHINE,ANTIQUE: SINGLE BUTTON OFFICE CALCULATOR,AddingMachine 6028_07_3,Adding Machines,6028-07-03,:01,6028,7,3,
ADDING MACHINE,ANTIQUE: PULL CRANK SLOW OFFICE CALCULATOR,AddingMachine 6028_07_4,Adding Machines,6028-07-04,:05,6028,7,4,
ADDING MACHINE,ANTIQUE: PULL CRANK SLOW OFFICE CALCULATOR,AddingMachine 6028_07_5,Adding Machines,6028-07-05,:05,6028,7,5,
ADDING MACHINE,ANTIQUE: PULL CRANK FAST OFFICE CALCULATOR,AddingMachine 6028_07_6,Adding Machines,6028-07-06,:04,6028,7,6,
ADDING MACHINE,ANTIQUE: PULL CRANK FAST OFFICE CALCULATOR,AddingMachine 6028_07_7,Adding Machines,6028-07-07,:04,6028,7,7,
ADDING MACHINE,ANTIQUE: PULL CRANK CASH DRAWER OPEN OFFICE CALCULATOR,AddingMachine 6028_07_8,Adding Machines,6028-07-08,:05,6028,7,8,
ADDING MACHINE,ANTIQUE: ADDING NUMBERS TOTAL AT END OFFICE CALCULATOR,AddingMachine 6028_08,Adding Machines,6028-08-01,:18,6028,8,1,
ADDING MACHINE,ELECTRIC: SINGLE BUTTON OFFICE CALCULATOR,AddingMachine 6028_09_1,Adding Machines,6028-09-01,:01,6028,9,1,
ADDING MACHINE,ELECTRIC: SINGLE BUTTON OFFICE CALCULATOR,AddingMachine 6028_09_2,Adding Machines,6028-09-02,:01,6028,9,2,
ADDING MACHINE,ELECTRIC: PRESS PLUS KEY PRINT TOTAL OFFICE CALCULATOR,AddingMachine 6028_09_3,Adding Machines,6028-09-03,:03,6028,9,3,
ADDING MACHINE,ELECTRIC: PRESS CLEAR KEY OFFICE CALCULATOR,AddingMachine 6028_09_4,Adding Machines,6028-09-04,:04,6028,9,4,
ADDING MACHINE,ELECTRIC: PRESS PLUS KEY THREE TIMES OFFICE CALCULATOR,AddingMachine 6028_09_5,Adding Machines,6028-09-05,:05,6028,9,5,
ADDING MACHINE,ELECTRIC: TEAR OFF PAPER PRINTOUT SLOW OFFICE CALCULATOR,AddingMachine 6028_09_6,Adding Machines,6028-09-06,:02,6028,9,6,
ADDING MACHINE,ELECTRIC: TEAR OFF PAPER PRINTOUT FAST OFFICE CALCULATOR,AddingMachine 6028_09_7,Adding Machines,6028-09-07,:01,6028,9,7,
ADDING MACHINE,ELECTRIC: ADDING NUMBERS TOTALING OFFICE CALCULATOR,AddingMachine 6028_10,Adding Machines,6028-10-01,:23,6028,10,1,
ADDING MACHINE,ELECTRONIC: SINGLE NUMBER BUTTON SLOW OFFICE CALCULATOR,AddingMachine 6028_11_1,Adding Machines,6028-11-01,:01,6028,11,1,
ADDING MACHINE,ELECTRONIC: SINGLE NUMBER BUTTON MEDIUM OFFICE CALCULATOR,AddingMachine 6028_11_2,Adding Machines,6028-11-02,:01,6028,11,2,
ADDING MACHINE,ELECTRONIC: SINGLE NUMBER BUTTON FAST OFFICE CALCULATOR,AddingMachine 6028_11_3,Adding Machines,6028-11-03,:01,6028,11,3,
ADDING MACHINE,ELECTRONIC: TOTAL KEY SLOW OFFICE CALCULATOR,AddingMachine 6028_11_4,Adding Machines,6028-11-04,:01,6028,11,4,
ADDING MACHINE,ELECTRONIC: TOTAL KEY MEDIUM OFFICE CALCULATOR,AddingMachine 6028_11_5,Adding Machines,6028-11-05,:01,6028,11,5,
ADDING MACHINE,ELECTRONIC: TOTAL KEY FAST OFFICE CALCULATOR,AddingMachine 6028_11_6,Adding Machines,6028-11-06,:01,6028,11,6,
ADDING MACHINE,ELECTRONIC: CLEAR BUTTON SLOW OFFICE CALCULATOR,AddingMachine 6028_11_7,Adding Machines,6028-11-07,:01,6028,11,7,
ADDING MACHINE,ELECTRONIC: CLEAR BUTTON MEDIUM OFFICE CALCULATOR,AddingMachine 6028_11_8,Adding Machines,6028-11-08,:01,6028,11,8,
ADDING MACHINE,ELECTRONIC: CLEAR BUTTON FAST OFFICE CALCULATOR,AddingMachine 6028_11_9,Adding Machines,6028-11-09,:01,6028,11,9,
ADDING MACHINE,ELECTRONIC: ADDING NUMBERS OFFICE CALCULATOR,AddingMachine 6028_11_10,Adding Machines,6028-11-10,:28,6028,11,10,
ADDING MACHINE,ELECTRONIC: PLUS KEY WITH PRINTOUT OFFICE CALCULATOR,AddingMachine 6028_12_1,Adding Machines,6028-12-01,:01,6028,12,1,
ADDING MACHINE,ELECTRONIC: TOTAL KEY WITH PRINTOUT OFFICE CALCULATOR,AddingMachine 6028_12_2,Adding Machines,6028-12-02,:01,6028,12,2,
ADDING MACHINE,ELECTRONIC: CLEAR KEY WITH PRINTOUT OFFICE CALCULATOR,AddingMachine 6028_12_3,Adding Machines,6028-12-03,:01,6028,12,3,
ADDING MACHINE,ELECTRONIC: CLEAR KEY WITH PRINTOUT THREE TIMES OFFICE CALCULATOR,AddingMachine 6028_12_4,Adding Machines,6028-12-04,:02,6028,12,4,
ADDING MACHINE,ELECTRONIC: ADVANCE PAPER OFFICE CALCULATOR,AddingMachine 6028_12_5,Adding Machines,6028-12-05,:04,6028,12,5,
ADDING MACHINE,ELECTRONIC: TEAR OFF PAPER PRINTOUT SLOW OFFICE CALCULATOR,AddingMachine 6028_12_6,Adding Machines,6028-12-06,:01,6028,12,6,
ADDING MACHINE,ELECTRONIC: TEAR OFF PAPER PRINTOUT FAST OFFICE CALCULATOR,AddingMachine 6028_12_7,Adding Machines,6028-12-07,:01,6028,12,7,
ADDING MACHINE,ELECTRONIC: ADDING NUMBERS AND PRINTOUT TOTAL OFFICE CALCULATOR,AddingMachine 6028_13,Adding Machines,6028-13-01,:19,6028,13,1,
AIR,SHORT SLOW RELEASE THROUGH VALVE,AirRelease 6010_01_1,Air Gases & Steam,6010-01-01,:02,6010,1,1,
AIR,SHORT FAST RELEASE THROUGH VALVE,AirRelease 6010_01_2,Air Gases & Steam,6010-01-02,:03,6010,1,2,
AIR,CONTINUOUS SLOW RELEASE THROUGH VALVE,AirRelease 6010_01_3,Air Gases & Steam,6010-01-03,:31,6010,1,3,
AIR,CONTINUOUS FAST RELEASE THROUGH VALVE,AirRelease 6010_01_4,Air Gases & Steam,6010-01-04,:31,6010,1,4,
AIR,CONTINUOUS RELEASE THROUGH VALVE WITH MODULATION,AirRelease 6010_01_5,Air Gases & Steam,6010-01-05,:30,6010,1,5,
AIR CONDITIONER,LARGE WALL UNIT: START RUN SHUT OFF FAN,AirConditioner 6020_01,Large Household Appliances,6020-01-01,1:02,6020,1,1,
AIR REGULATOR,QUICK RELEASE THROUGH REGULATOR,AirRegulator 6010_02_1,SCUBA Divers;Scuba Diving,6010-02-01,:01,6010,2,1,
AIR REGULATOR,THREE QUICK RELEASES THROUGH REGULATOR,AirRegulator 6010_02_2,SCUBA Divers;Scuba Diving,6010-02-02,:02,6010,2,2,
AIR REGULATOR,SHORT SLOW RELEASE THROUGH REGULATOR,AirRegulator 6010_02_3,SCUBA Divers;Scuba Diving,6010-02-03,:12,6010,2,3,
AIR REGULATOR,SHORT FAST RELEASE THROUGH REGULATOR,AirRegulator 6010_02_4,SCUBA Divers;Scuba Diving,6010-02-04,:03,6010,2,4,
AIR REGULATOR,CONTINUOUS SLOW RELEASE THROUGH REGULATOR,AirRegulator 6010_02_5,SCUBA Divers;Scuba Diving,6010-02-05,:38,6010,2,5,
AIR REGULATOR,CONTINUOUS FAST RELEASE THROUGH REGULATOR,AirRegulator 6010_02_6,SCUBA Divers;Scuba Diving,6010-02-06,:32,6010,2,6,
AIR REGULATOR,CONTINUOUS RELEASE THROUGH REGULATOR MODULATION,AirRegulator 6010_02_7,SCUBA Divers;Scuba Diving,6010-02-07,:34,6010,2,7,
AIR REGULATOR,SLOW BREATHING THROUGH REGULATOR HUMAN,AirRegulator 6010_03_1,SCUBA Divers;Scuba Diving,6010-03-01,1:00,6010,3,1,
AIR REGULATOR,FAST BREATHING THROUGH REGULATOR HUMAN,AirRegulator 6010_03_2,SCUBA Divers;Scuba Diving,6010-03-02,1:01,6010,3,2,
AIR RELEASE,PRESSURIZED AIR RELEASED THROUGH HOSE,AirRelease 6040_01_1,Air Gases & Steam,6040-01-01,:02,6040,1,1,
AIR RELEASE,PRESSURIZED AIR RELEASED THROUGH HOSE,AirRelease 6040_01_2,Air Gases & Steam,6040-01-02,:02,6040,1,2,
AIR RELEASE,PRESSURIZED AIR RELEASED THROUGH HOSE,AirRelease 6040_01_3,Air Gases & Steam,6040-01-03,:02,6040,1,3,
AIR RELEASE,PRESSURIZED AIR RELEASED THROUGH HOSE,AirRelease 6040_01_4,Air Gases & Steam,6040-01-04,:03,6040,1,4,
AIR RELEASE,PRESSURIZED AIR RELEASED THROUGH HOSE,AirRelease 6040_01_5,Air Gases & Steam,6040-01-05,:03,6040,1,5,
AIR RELEASE,PRESSURIZED AIR RELEASED THROUGH HOSE,AirRelease 6040_02_1,Air Gases & Steam,6040-02-01,:03,6040,2,1,
AIR RELEASE,PRESSURIZED AIR RELEASED THROUGH HOSE,AirRelease 6040_02_2,Air Gases & Steam,6040-02-02,:04,6040,2,2,
AIR RELEASE,PRESSURIZED AIR RELEASED THROUGH HOSE,AirRelease 6040_02_3,Air Gases & Steam,6040-02-03,:04,6040,2,3,
AIR RELEASE,PRESSURIZED AIR RELEASED THROUGH HOSE,AirRelease 6040_02_4,Air Gases & Steam,6040-02-04,:06,6040,2,4,
AIR RELEASE,PRESSURIZED AIR RELEASED THROUGH HOSE,AirRelease 6040_02_5,Air Gases & Steam,6040-02-05,:07,6040,2,5,
AIRCRAFT CARRIER,GENERAL INTERIOR RUMBLE SHIP MARINE,AircraftCarrier 6025_65,Aircraft Carriers,6025-65-01,1:32,6025,65,1,
AIRPLANE BIPLANE,STEARMAN: FROM COCKPIT START IDLE,AirplaneBiplane 6001_01,Vintage Airplanes & Propeller Planes,6001-01-01,1:47,6001,1,1,
AIRPLANE BIPLANE,STEARMAN: FROM COCKPIT IDLE TAKE OFF,AirplaneBiplane 6001_02,Vintage Airplanes & Propeller Planes,6001-02-01,1:36,6001,2,1,
AIRPLANE BIPLANE,STEARMAN: FROM COCKPIT IN FLIGHT,AirplaneBiplane 6001_03,Vintage Airplanes & Propeller Planes,6001-03-01,1:30,6001,3,1,
AIRPLANE BIPLANE,STEARMAN: FROM COCKPIT IN FLIGHT,AirplaneBiplane 6001_04,Vintage Airplanes & Propeller Planes,6001-04-01,1:04,6001,4,1,
AIRPLANE BIPLANE,STEARMAN: FROM COCKPIT IN FLIGHT LAND IDLE SHUT OFF,AirplaneBiplane 6001_05,Vintage Airplanes & Propeller Planes,6001-05-01,2:19,6001,5,1,
AIRPLANE BIPLANE,STEARMAN: EXTERNAL: START IDLE SHUT OFF,AirplaneBiplane 6001_06,Vintage Airplanes & Propeller Planes,6001-06-01,1:53,6001,6,1,
AIRPLANE BIPLANE,STEARMAN: EXTERNAL: IDLE TAKE OFF,AirplaneBiplane 6001_07,Vintage Airplanes & Propeller Planes,6001-07-01,:56,6001,7,1,
AIRPLANE BIPLANE,STEARMAN: EXTERNAL: PASS BY,AirplaneBiplane 6001_08,Vintage Airplanes & Propeller Planes,6001-08-01,:10,6001,8,1,
AIRPLANE BIPLANE,STEARMAN: EXTERNAL: PASS BY,AirplaneBiplane 6001_09,Vintage Airplanes & Propeller Planes,6001-09-01,:09,6001,9,1,
AIRPLANE CABIN,INTERNAL: CABIN: START ENGINES,AirplaneCabin 6002_67,Airplane Interior Perspectives,6002-67-01,1:22,6002,67,1,
AIRPLANE CABIN,INTERNAL: CABIN: IDLING WITH AIR CONDITIONING,AirplaneCabin 6002_68,Airplane Interior Perspectives,6002-68-01,1:00,6002,68,1,
AIRPLANE CABIN,INTERNAL: CABIN: IDLING WITHOUT AIR CONDITIONING,AirplaneCabin 6002_69,Airplane Interior Perspectives,6002-69-01,:30,6002,69,1,
AIRPLANE CABIN,INTERNAL: CABIN: TAXIING TO RUNWAY,AirplaneCabin 6002_70,Airplane Interior Perspectives,6002-70-01,1:00,6002,70,1,
AIRPLANE CABIN,INTERNAL: CABIN: TAKE OFF AND CLIMB,AirplaneCabin 6002_71,Airplane Interior Perspectives,6002-71-01,3:24,6002,71,1,
AIRPLANE CABIN,INTERNAL: CABIN: IN FLIGHT,AirplaneCabin 6002_72,Airplane Interior Perspectives,6002-72-01,2:00,6002,72,1,
AIRPLANE CABIN,INTERNAL: CABIN: DESCEND AND LAND,AirplaneCabin 6002_73,Airplane Interior Perspectives,6002-73-01,1:37,6002,73,1,
AIRPLANE CABIN,INTERNAL: CABIN: ANNOUNCEMENT BELL,AirplaneCabin 6002_74_1,Airplane Interior Perspectives,6002-74-01,:01,6002,74,1,
AIRPLANE CABIN,INTERNAL: CABIN: ANNOUNCEMENT BELL,AirplaneCabin 6002_74_2,Airplane Interior Perspectives,6002-74-02,:01,6002,74,2,
AIRPLANE CABIN,INTERNAL: CABIN: OVERHEAD STORAGE BIN OPEN DOOR,AirplaneCabin 6002_75_1,Airplane Interior Perspectives,6002-75-01,:01,6002,75,1,
AIRPLANE CABIN,INTERNAL: CABIN: OVERHEAD STORAGE BIN OPEN DOOR,AirplaneCabin 6002_75_2,Airplane Interior Perspectives,6002-75-02,:01,6002,75,2,
AIRPLANE CABIN,INTERNAL: CABIN: OVERHEAD STORAGE BIN CLOSE DOOR,AirplaneCabin 6002_75_3,Airplane Interior Perspectives,6002-75-03,:01,6002,75,3,
AIRPLANE CABIN,INTERNAL: CABIN: OVERHEAD STORAGE BIN CLOSE DOOR,AirplaneCabin 6002_75_4,Airplane Interior Perspectives,6002-75-04,:01,6002,75,4,
AIRPLANE CABIN,INTERNAL: CABIN: OVERHEAD LIGHT SWITCH ON,AirplaneCabin 6002_76_1,Airplane Interior Perspectives,6002-76-01,:01,6002,76,1,
AIRPLANE CABIN,INTERNAL: CABIN: OVERHEAD LIGHT SWITCH OFF,AirplaneCabin 6002_76_2,Airplane Interior Perspectives,6002-76-02,:01,6002,76,2,
AIRPLANE CABIN,INTERNAL: CABIN: SEAT BELT FASTEN,AirplaneCabin 6002_77_1,Airplane Interior Perspectives,6002-77-01,:01,6002,77,1,
AIRPLANE CABIN,INTERNAL: CABIN: SEAT BELT UNFASTEN,AirplaneCabin 6002_77_2,Airplane Interior Perspectives,6002-77-02,:01,6002,77,2,
AIRPLANE CABIN,INTERNAL: CABIN: ASH TRAY OPEN,AirplaneCabin 6002_78_1,Airplane Interior Perspectives,6002-78-01,:01,6002,78,1,
AIRPLANE CABIN,INTERNAL: CABIN: ASH TRAY CLOSE,AirplaneCabin 6002_78_2,Airplane Interior Perspectives,6002-78-02,:01,6002,78,2,
AIRPLANE CABIN,INTERNAL: CABIN: ARMREST MOUNTED TRAY TABLE CLOSE COVER,AirplaneCabin 6002_79_1,Airplane Interior Perspectives,6002-79-01,:01,6002,79,1,
AIRPLANE CABIN,INTERNAL: CABIN: ARMREST MOUNTED TRAY TABLE OPEN COVER,AirplaneCabin 6002_79_2,Airplane Interior Perspectives,6002-79-02,:01,6002,79,2,
AIRPLANE CABIN,INTERNAL: CABIN: ARMREST MOUNTED TRAY TABLE OPEN,AirplaneCabin 6002_79_3,Airplane Interior Perspectives,6002-79-03,:06,6002,79,3,
AIRPLANE CABIN,INTERNAL: CABIN: ARMREST MOUNTED TRAY TABLE CLOSE,AirplaneCabin 6002_79_4,Airplane Interior Perspectives,6002-79-04,:06,6002,79,4,
AIRPLANE CABIN,INTERNAL: CABIN: PUBLIC ADDRESS PHONE REMOVE FROM HOLDER,AirplaneCabin 6002_80_1,Airplane Interior Perspectives,6002-80-01,:01,6002,80,1,
AIRPLANE CABIN,INTERNAL: CABIN: PUBLIC ADDRESS PHONE PUT INTO HOLDER,AirplaneCabin 6002_80_2,Airplane Interior Perspectives,6002-80-02,:02,6002,80,2,
AIRPLANE CABIN,INTERNAL: CABIN: CABIN DOOR EMERGENCY CHUTE ALARM,AirplaneCabin 6002_81_1,Airplane Interior Perspectives,6002-81-01,:01,6002,81,1,
AIRPLANE CABIN,INTERNAL: CABIN: CABIN DOOR EMERGENCY CHUTE ALARM,AirplaneCabin 6002_81_2,Airplane Interior Perspectives,6002-81-02,:04,6002,81,2,
AIRPLANE CABIN,INTERNAL: CABIN: GALLEY STORAGE DOOR OPEN,AirplaneCabin 6002_82_1,Airplane Interior Perspectives,6002-82-01,:01,6002,82,1,
AIRPLANE CABIN,INTERNAL: CABIN: GALLEY STORAGE DOOR OPEN,AirplaneCabin 6002_82_2,Airplane Interior Perspectives,6002-82-02,:01,6002,82,2,
AIRPLANE CABIN,INTERNAL: CABIN: GALLEY STORAGE DOOR CLOSE,AirplaneCabin 6002_82_3,Airplane Interior Perspectives,6002-82-03,:01,6002,82,3,
AIRPLANE CABIN,INTERNAL: CABIN: GALLEY STORAGE DOOR CLOSE,AirplaneCabin 6002_82_4,Airplane Interior Perspectives,6002-82-04,:01,6002,82,4,
AIRPLANE CABIN,INTERNAL: CABIN: LAVATORY DOOR OPEN,AirplaneCabin 6002_83_1,Airplane Interior Perspectives,6002-83-01,:02,6002,83,1,
AIRPLANE CABIN,INTERNAL: CABIN: LAVATORY DOOR OPEN,AirplaneCabin 6002_83_2,Airplane Interior Perspectives,6002-83-02,:02,6002,83,2,
AIRPLANE CABIN,INTERNAL: CABIN: LAVATORY DOOR CLOSE,AirplaneCabin 6002_83_3,Airplane Interior Perspectives,6002-83-03,:02,6002,83,3,
AIRPLANE CABIN,INTERNAL: CABIN: LAVATORY DOOR CLOSE,AirplaneCabin 6002_83_4,Airplane Interior Perspectives,6002-83-04,:02,6002,83,4,
AIRPLANE CABIN,INTERNAL: CABIN: LAVATORY DOOR LOCK,AirplaneCabin 6002_84_1,Airplane Interior Perspectives,6002-84-01,:01,6002,84,1,
AIRPLANE CABIN,INTERNAL: CABIN: LAVATORY DOOR UNLOCK,AirplaneCabin 6002_84_2,Airplane Interior Perspectives,6002-84-02,:01,6002,84,2,
AIRPLANE CABIN,INTERNAL: CABIN: LAVATORY DOOR UNLOCK,AirplaneCabin 6002_84_3,Airplane Interior Perspectives,6002-84-03,:01,6002,84,3,
AIRPLANE CABIN,INTERNAL: CABIN: LAVATORY PAPER CUP DISPENSER REMOVE CUP,AirplaneCabin 6002_85_1,Airplane Interior Perspectives,6002-85-01,:01,6002,85,1,
AIRPLANE CABIN,INTERNAL: CABIN: LAVATORY PAPER CUP DISPENSER REMOVE CUP,AirplaneCabin 6002_85_2,Airplane Interior Perspectives,6002-85-02,:01,6002,85,2,
AIRPLANE CABIN,INTERNAL: CABIN: LAVATORY TOWEL DISPENSER REMOVE TOWEL,AirplaneCabin 6002_86_1,Airplane Interior Perspectives,6002-86-01,:02,6002,86,1,
AIRPLANE CABIN,INTERNAL: CABIN: LAVATORY TOWEL DISPENSER REMOVE TOWEL,AirplaneCabin 6002_86_2,Airplane Interior Perspectives,6002-86-02,:01,6002,86,2,
AIRPLANE COCKPIT,INTERNAL: COCKPIT: TAKE OFF AND CLIMB,AirplaneCockpit 6002_58,Airplane Interior Perspectives,6002-58-01,2:09,6002,58,1,
AIRPLANE COCKPIT,INTERNAL: COCKPIT: IN FLIGHT,AirplaneCockpit 6002_59,Airplane Interior Perspectives,6002-59-01,1:00,6002,59,1,
AIRPLANE COCKPIT,INTERNAL: COCKPIT: DESCEND AND LAND,AirplaneCockpit 6002_60,Airplane Interior Perspectives,6002-60-01,2:09,6002,60,1,
AIRPLANE COCKPIT,INTERNAL: COCKPIT: TAKE OFF ABORT WARNING ALARM,AirplaneCockpit 6002_61_1,Airplane Interior Perspectives,6002-61-01,:16,6002,61,1,
AIRPLANE COCKPIT,INTERNAL: COCKPIT: STABILIZER TRIM FUNCTION INDICATOR ALARM,AirplaneCockpit 6002_61_2,Airplane Interior Perspectives,6002-61-02,:12,6002,61,2,
AIRPLANE COCKPIT,INTERNAL: COCKPIT: ENGINE FIRE ALARM,AirplaneCockpit 6002_61_3,Airplane Interior Perspectives,6002-61-03,:06,6002,61,3,
AIRPLANE COCKPIT,INTERNAL: COCKPIT: MAXIMUM AIR SPEED WARNING ALARM,AirplaneCockpit 6002_61_4,Airplane Interior Perspectives,6002-61-04,:16,6002,61,4,
AIRPLANE COCKPIT,INTERNAL: COCKPIT: ENGINE STALL WARNING ALARM,AirplaneCockpit 6002_61_5,Airplane Interior Perspectives,6002-61-05,:32,6002,61,5,
AIRPLANE COCKPIT,INTERNAL: COCKPIT: GROUND PROXIMITY LANDING GEAR WARNING ALARM,AirplaneCockpit 6002_62_1,Airplane Interior Perspectives,6002-62-01,:16,6002,62,1,
AIRPLANE COCKPIT,INTERNAL: COCKPIT: GROUND PROXIMITY WARNING ALARM,AirplaneCockpit 6002_62_2,Airplane Interior Perspectives,6002-62-02,:31,6002,62,2,
AIRPLANE COCKPIT,INTERNAL: COCKPIT: LANDING GEAR WARNING ALARM,AirplaneCockpit 6002_62_3,Airplane Interior Perspectives,6002-62-03,:17,6002,62,3,
AIRPLANE COCKPIT,INTERNAL: COCKPIT: GLIDE SLOPE WARNING ALARM,AirplaneCockpit 6002_62_4,Airplane Interior Perspectives,6002-62-04,:14,6002,62,4,
AIRPLANE COCKPIT,INTERNAL: COCKPIT: OUTER MARKER INDICATOR ALARM,AirplaneCockpit 6002_62_5,Airplane Interior Perspectives,6002-62-05,:09,6002,62,5,
AIRPLANE COCKPIT,INTERNAL: COCKPIT: INSTRUMENT PANEL SWITCH,AirplaneCockpit 6002_63_1,Airplane Interior Perspectives,6002-63-01,:01,6002,63,1,
AIRPLANE COCKPIT,INTERNAL: COCKPIT: INSTRUMENT PANEL SWITCH,AirplaneCockpit 6002_63_2,Airplane Interior Perspectives,6002-63-02,:01,6002,63,2,
AIRPLANE COCKPIT,INTERNAL: COCKPIT: INSTRUMENT PANEL SWITCH,AirplaneCockpit 6002_63_3,Airplane Interior Perspectives,6002-63-03,:01,6002,63,3,
AIRPLANE COCKPIT,INTERNAL: COCKPIT: INSTRUMENT PANEL SWITCH,AirplaneCockpit 6002_63_4,Airplane Interior Perspectives,6002-63-04,:01,6002,63,4,
AIRPLANE COCKPIT,INTERNAL: COCKPIT: INSTRUMENT PANEL SWITCH,AirplaneCockpit 6002_64_1,Airplane Interior Perspectives,6002-64-01,:01,6002,64,1,
AIRPLANE COCKPIT,INTERNAL: COCKPIT: INSTRUMENT PANEL ROTARY SWITCH,AirplaneCockpit 6002_64_2,Airplane Interior Perspectives,6002-64-02,:01,6002,64,2,
AIRPLANE COCKPIT,INTERNAL: COCKPIT: INSTRUMENT PANEL ROTARY SWITCH,AirplaneCockpit 6002_64_3,Airplane Interior Perspectives,6002-64-03,:01,6002,64,3,
AIRPLANE COCKPIT,INTERNAL: COCKPIT: INSTRUMENT PANEL ROTARY SWITCH,AirplaneCockpit 6002_64_4,Airplane Interior Perspectives,6002-64-04,:01,6002,64,4,
AIRPLANE COCKPIT,INTERNAL: COCKPIT: PARKING BRAKE APPLY,AirplaneCockpit 6002_65_1,Airplane Interior Perspectives,6002-65-01,:01,6002,65,1,
AIRPLANE COCKPIT,INTERNAL: COCKPIT: PARKING BRAKE RELEASE,AirplaneCockpit 6002_65_2,Airplane Interior Perspectives,6002-65-02,:01,6002,65,2,
AIRPLANE COCKPIT,INTERNAL: COCKPIT: SEAT SLIDE FORWARD,AirplaneCockpit 6002_66_1,Airplane Interior Perspectives,6002-66-01,:02,6002,66,1,
AIRPLANE COCKPIT,INTERNAL: COCKPIT: SEAT SLIDE BACK,AirplaneCockpit 6002_66_2,Airplane Interior Perspectives,6002-66-02,:02,6002,66,2,
AIRPLANE JET,LEAR: INTERNAL: START IDLE,AirplaneJet 6001_43,Airplane Interior Perspectives,6001-43-01,2:17,6001,43,1,
AIRPLANE JET,LEAR: INTERNAL: IDLE,AirplaneJet 6001_44,Airplane Interior Perspectives,6001-44-01,1:33,6001,44,1,
AIRPLANE JET,LEAR: INTERNAL: TAXI TO RUNWAY,AirplaneJet 6001_45,Airplane Interior Perspectives,6001-45-01,2:31,6001,45,1,
AIRPLANE JET,LEAR: INTERNAL: TAKE OFF,AirplaneJet 6001_46,Airplane Interior Perspectives,6001-46-01,2:29,6001,46,1,
AIRPLANE JET,LEAR: INTERNAL: IN FLIGHT BANKING,AirplaneJet 6001_47,Airplane Interior Perspectives,6001-47-01,2:54,6001,47,1,
AIRPLANE JET,LEAR: INTERNAL: IN FLIGHT TO DESCEND LAND,AirplaneJet 6001_48,Airplane Interior Perspectives,6001-48-01,3:29,6001,48,1,
AIRPLANE JET,LEAR: INTERNAL: TAXI TO TARMAC PILOT CHECK LIST,AirplaneJet 6001_49,Airplane Interior Perspectives,6001-49-01,1:15,6001,49,1,
AIRPLANE JET,LEAR: EXTERNAL: FIRST ENGINE START,AirplaneJet 6001_50,Airplane Exterior Perspectives,6001-50-01,1:01,6001,50,1,
AIRPLANE JET,LEAR: EXTERNAL: SECOND ENGINE START,AirplaneJet 6001_51,Airplane Exterior Perspectives,6001-51-01,1:02,6001,51,1,
AIRPLANE JET,LEAR: EXTERNAL: APPROACH TAKE OFF,AirplaneJet 6001_52,Airplane Exterior Perspectives,6001-52-01,:40,6001,52,1,
AIRPLANE JET,LEAR: EXTERNAL: PASS BY,AirplaneJet 6001_53,Airplane Exterior Perspectives,6001-53-01,:32,6001,53,1,
AIRPLANE JET,LEAR: EXTERNAL: PASS BY,AirplaneJet 6001_54,Airplane Exterior Perspectives,6001-54-01,:30,6001,54,1,
AIRPLANE JET,LEAR: EXTERNAL: PASS BY,AirplaneJet 6001_55,Airplane Exterior Perspectives,6001-55-01,:35,6001,55,1,
AIRPLANE JET,LEAR: EXTERNAL: APPROACH LAND,AirplaneJet 6001_56,Airplane Exterior Perspectives,6001-56-01,:30,6001,56,1,
AIRPLANE JET,LEAR: EXTERNAL: TAXI OUT,AirplaneJet 6001_57,Airplane Exterior Perspectives,6001-57-01,1:04,6001,57,1,
AIRPLANE JET,F-15: PASS BY OVERHEAD,AirplaneJet 6002_87,Fighter Jets & Bombers,6002-87-01,:32,6002,87,1,
AIRPLANE JET,F-15: TWO PASS BY OVERHEAD,AirplaneJet 6002_88,Fighter Jets & Bombers,6002-88-01,:27,6002,88,1,
AIRPLANE JET,F-15: TWO PASS BY OVERHEAD DISTANT,AirplaneJet 6002_89,Fighter Jets & Bombers,6002-89-01,:50,6002,89,1,
AIRPLANE JET,F-16: PASS BY OVERHEAD,AirplaneJet 6002_90,Fighter Jets & Bombers,6002-90-01,:21,6002,90,1,
AIRPLANE JET,F-16: PASS BY OVERHEAD,AirplaneJet 6002_91,Fighter Jets & Bombers,6002-91-01,:18,6002,91,1,
AIRPLANE JET,F-16: PASS BY FAR OVERHEAD,AirplaneJet 6002_92,Fighter Jets & Bombers,6002-92-01,:31,6002,92,1,
AIRPLANE JET,S-3B VIKING: CATAPULT FROM AIRCRAFT CARRIER,AirplaneJet 6002_93,Fighter Jets & Bombers,6002-93-01,:52,6002,93,1,
AIRPLANE JET,S-3B VIKING: ARRESTED LANDING ON AIRCRAFT CARRIER,AirplaneJet 6002_94,Fighter Jets & Bombers,6002-94-01,:31,6002,94,1,
AIRPLANE JET,F/A-18 HORNET: TAXI CATAPULT FROM AIRCRAFT CARRIER,AirplaneJet 6002_95,Fighter Jets & Bombers,6002-95-01,1:19,6002,95,1,
AIRPLANE JET,F/A-18 HORNET: CATAPULT FROM AIRCRAFT CARRIER,AirplaneJet 6002_96,Fighter Jets & Bombers,6002-96-01,:35,6002,96,1,
AIRPLANE JET,F/A-18 HORNET: CATAPULT FROM AIRCRAFT CARRIER,AirplaneJet 6002_97,Fighter Jets & Bombers,6002-97-01,:30,6002,97,1,
AIRPLANE JET,F/A-18 HORNET: PASS BY FROM AIRCRAFT CARRIER,AirplaneJet 6002_98,Fighter Jets & Bombers,6002-98-01,:30,6002,98,1,
AIRPLANE JET,F/A-18 HORNET: ARRESTED LANDING ON AIRCRAFT CARRIER,AirplaneJet 6002_99,Fighter Jets & Bombers,6002-99-01,:19,6002,99,1,
AIRPLANE JET,727: EXTERNAL: TAKE OFF,AirplaneJet 6002_12,Airplane Exterior Perspectives,6002-12-01,:48,6002,12,1,
AIRPLANE JET,727: EXTERNAL: TAKE OFF,AirplaneJet 6002_13,Airplane Exterior Perspectives,6002-13-01,:30,6002,13,1,
AIRPLANE JET,727: EXTERNAL: PASS OVERHEAD BEFORE LANDING,AirplaneJet 6002_14,Airplane Exterior Perspectives,6002-14-01,:24,6002,14,1,
AIRPLANE JET,727: EXTERNAL: LANDING,AirplaneJet 6002_15,Airplane Exterior Perspectives,6002-15-01,:44,6002,15,1,
AIRPLANE JET,727: EXTERNAL: LANDING,AirplaneJet 6002_16,Airplane Exterior Perspectives,6002-16-01,:23,6002,16,1,
AIRPLANE JET,737: EXTERNAL: TAXI PAST,AirplaneJet 6002_17,Airplane Exterior Perspectives,6002-17-01,:54,6002,17,1,
AIRPLANE JET,737: EXTERNAL: ACCELERATE DOWN RUNWAY FROM STAND STILL,AirplaneJet 6002_18,Airplane Exterior Perspectives,6002-18-01,:35,6002,18,1,
AIRPLANE JET,737: EXTERNAL: TAKE OFF,AirplaneJet 6002_19,Airplane Exterior Perspectives,6002-19-01,:43,6002,19,1,
AIRPLANE JET,737: EXTERNAL: TAKE OFF,AirplaneJet 6002_20,Airplane Exterior Perspectives,6002-20-01,1:05,6002,20,1,
AIRPLANE JET,737: EXTERNAL: PASS OVERHEAD BEFORE LANDING,AirplaneJet 6002_21,Airplane Exterior Perspectives,6002-21-01,:24,6002,21,1,
AIRPLANE JET,737: EXTERNAL: PASS OVERHEAD BEFORE LANDING,AirplaneJet 6002_22,Airplane Exterior Perspectives,6002-22-01,:30,6002,22,1,
AIRPLANE JET,737: EXTERNAL: LANDING,AirplaneJet 6002_23,Airplane Exterior Perspectives,6002-23-01,:44,6002,23,1,
AIRPLANE JET,737: EXTERNAL: LANDING,AirplaneJet 6002_24,Airplane Exterior Perspectives,6002-24-01,:36,6002,24,1,
AIRPLANE JET,DC-9: EXTERNAL: TAXI PAST,AirplaneJet 6002_25,Airplane Exterior Perspectives,6002-25-01,1:28,6002,25,1,
AIRPLANE JET,DC-9: EXTERNAL: TAKE OFF,AirplaneJet 6002_26,Airplane Exterior Perspectives,6002-26-01,:41,6002,26,1,
AIRPLANE JET,DC-9: EXTERNAL: TAKE OFF,AirplaneJet 6002_27,Airplane Exterior Perspectives,6002-27-01,:39,6002,27,1,
AIRPLANE JET,DC-9: EXTERNAL: LANDING,AirplaneJet 6002_28,Airplane Exterior Perspectives,6002-28-01,:22,6002,28,1,
AIRPLANE JET,A-320: EXTERNAL: TAXI PAST,AirplaneJet 6002_29,Airplane Exterior Perspectives,6002-29-01,:50,6002,29,1,
AIRPLANE JET,A-320: EXTERNAL: TAKE OFF,AirplaneJet 6002_30,Airplane Exterior Perspectives,6002-30-01,:37,6002,30,1,
AIRPLANE JET,A-320: EXTERNAL: TAKE OFF,AirplaneJet 6002_31,Airplane Exterior Perspectives,6002-31-01,:22,6002,31,1,
AIRPLANE JET,A-320: EXTERNAL: PASS OVERHEAD BEFORE LANDING,AirplaneJet 6002_32,Airplane Exterior Perspectives,6002-32-01,:27,6002,32,1,
AIRPLANE JET,A-320: EXTERNAL: LANDING,AirplaneJet 6002_33,Airplane Exterior Perspectives,6002-33-01,:39,6002,33,1,
AIRPLANE JET,MD-80: EXTERNAL: ACCELERATE DOWN RUNWAY FROM STAND STILL,AirplaneJet 6002_34,Airplane Exterior Perspectives,6002-34-01,:46,6002,34,1,
AIRPLANE JET,MD-80: EXTERNAL: TAKE OFF,AirplaneJet 6002_35,Airplane Exterior Perspectives,6002-35-01,:37,6002,35,1,
AIRPLANE JET,MD-80: EXTERNAL: PASS OVERHEAD BEFORE LANDING,AirplaneJet 6002_36,Airplane Exterior Perspectives,6002-36-01,:23,6002,36,1,
AIRPLANE JET,MD-80: EXTERNAL: LANDING,AirplaneJet 6002_37,Airplane Exterior Perspectives,6002-37-01,:41,6002,37,1,
AIRPLANE JET,767: EXTERNAL: ACCELERATE DOWN RUNWAY FROM STAND STILL,AirplaneJet 6002_38,Airplane Exterior Perspectives,6002-38-01,:47,6002,38,1,
AIRPLANE JET,767: EXTERNAL: TAKE OFF,AirplaneJet 6002_39,Airplane Exterior Perspectives,6002-39-01,:21,6002,39,1,
AIRPLANE JET,767: EXTERNAL: PASS OVERHEAD BEFORE LANDING,AirplaneJet 6002_40,Airplane Exterior Perspectives,6002-40-01,:31,6002,40,1,
AIRPLANE JET,767: EXTERNAL: LANDING,AirplaneJet 6002_41,Airplane Exterior Perspectives,6002-41-01,:41,6002,41,1,
AIRPLANE JET,747: EXTERNAL: TAXI PAST,AirplaneJet 6002_42,Airplane Exterior Perspectives,6002-42-01,:46,6002,42,1,
AIRPLANE JET,747: EXTERNAL: TAKE OFF,AirplaneJet 6002_43,Airplane Exterior Perspectives,6002-43-01,:35,6002,43,1,
