TrackTitle,TrackDescription,FileName,Keywords,MediaCode,TrackTime,TrackCD,TrackTrack,TrackIndex,
LION,TWO LIONS ROARING ANIMAL CAT,AnimalLion 6003_88_1,Wild Cats - Lions Tigers Jaguars,6003-88-01,:07,6003,88,1,
LION,ROARING ANIMAL CAT,AnimalLion 6003_88_2,Wild Cats - Lions Tigers Jaguars,6003-88-02,:03,6003,88,2,
LION,SNARLS GROWLS ANIMAL CAT,AnimalLion 6003_88_3,Wild Cats - Lions Tigers Jaguars,6003-88-03,:09,6003,88,3,
LION,GROWLING ANIMAL CAT,AnimalLion 6003_88_4,Wild Cats - Lions Tigers Jaguars,6003-88-04,:03,6003,88,4,
LION,THREE SNARLS ANIMAL CAT,AnimalLion 6003_88_5,Wild Cats - Lions Tigers Jaguars,6003-88-05,:03,6003,88,5,
LION,GROWL CLOSE UP ANIMAL CAT,AnimalLion 6003_88_6,Wild Cats - Lions Tigers Jaguars,6003-88-06,:13,6003,88,6,
LION,MOANING ANIMAL CAT,AnimalLion 6003_88_7,Wild Cats - Lions Tigers Jaguars,6003-88-07,:05,6003,88,7,
LOCK BICYCLE,KEY IN TURN REMOVE SHACKLE,LockBicycle 6021_18_1,Chain Locks,6021-18-01,:04,6021,18,1,
LOCK BICYCLE,REPLACE SHACKLE TURN KEY AND REMOVE,LockBicycle 6021_18_2,Chain Locks,6021-18-02,:04,6021,18,2,
LOCK PADLOCK,INSERT KEY OPEN SLOW,LockPadlock 6021_19_1,Padlocks,6021-19-01,:02,6021,19,1,
LOCK PADLOCK,INSERT KEY OPEN FAST,LockPadlock 6021_19_2,Padlocks,6021-19-02,:01,6021,19,2,
LOCK PADLOCK,CLOSE SHACKLE,LockPadlock 6021_19_3,Padlocks,6021-19-03,:01,6021,19,3,
LOCK PADLOCK,OPEN SHACKLE,LockPadlock 6021_19_4,Padlocks,6021-19-04,:01,6021,19,4,
LOCK PADLOCK,CLOSE SHACKLE,LockPadlock 6021_19_5,Padlocks,6021-19-05,:01,6021,19,5,
LOCKER ROOM,ELECTRIC HAND DRYER,LockerRoom 6031_94,Miscellaneous Sports,6031-94-01,1:00,6031,94,1,
LOCKER ROOM,SINK: RUN SLOW INSTITUTIONAL,LockerRoom 6031_95_1,Miscellaneous Sports,6031-95-01,:16,6031,95,1,
LOCKER ROOM,SINK: RUN FAST INSTITUTIONAL,LockerRoom 6031_95_2,Miscellaneous Sports,6031-95-02,:23,6031,95,2,
LOCKER ROOM,SHOWER: SINGLE SHOWER DRIPPING INSTITUTIONAL,LockerRoom 6031_96_1,Miscellaneous Sports,6031-96-01,:30,6031,96,1,
LOCKER ROOM,SHOWER: SINGLE SHOWER ON RUN OFF INSTITUTIONAL,LockerRoom 6031_96_2,Miscellaneous Sports,6031-96-02,1:00,6031,96,2,
LOCKER ROOM,SHOWERS: SEVERAL RUNNING INSTITUTIONAL,LockerRoom 6031_96_3,Miscellaneous Sports,6031-96-03,1:00,6031,96,3,
LOCKER ROOM,WHIRLPOOL: START RUN STOP INDOOR,LockerRoom 6031_97,Miscellaneous Sports,6031-97-01,1:00,6031,97,1,
LOCKER ROOM,TOILET: FLUSH INSIDE STALL INSTITUTIONAL,LockerRoom 6031_98_1,Miscellaneous Sports,6031-98-01,:26,6031,98,1,
LOCKER ROOM,TOILET: FLUSH OUTSIDE STALL INSTITUTIONAL,LockerRoom 6031_98_2,Miscellaneous Sports,6031-98-02,:15,6031,98,2,
LOCKER ROOM,URINAL: FLUSH INSTITUTIONAL,LockerRoom 6031_99_1,Miscellaneous Sports,6031-99-01,:07,6031,99,1,
LOCKER ROOM,URINAL: FLUSH INSTITUTIONAL,LockerRoom 6031_99_2,Miscellaneous Sports,6031-99-02,:09,6031,99,2,
LOOM,ANTIQUE LOOM: IN USE WEAVING,Loom 6032_57,Other Hand Tools,6032-57-01,1:02,6032,57,1,
MACHINE SHOP,AMBIENCE: MACHINERY CONSTRUCTION,IndustryMachineShop 6012_80,Construction & Demolition Ambiences,6012-80-01,2:00,6012,80,1,
MACHINE SHOP,AMBIENCE: MACHINERY AND HAND TOOLS CONSTRUCTION,IndustryMachineShop 6012_81,Construction & Demolition Ambiences,6012-81-01,2:00,6012,81,1,
MAGAZINE,OPEN,Magazine 6028_69_1,Books Binders Magazines & Newspapers,6028-69-01,:02,6028,69,1,
MAGAZINE,CLOSE,Magazine 6028_69_2,Books Binders Magazines & Newspapers,6028-69-02,:02,6028,69,2,
MAGAZINE,LEAF THROUGH PAGES,Magazine 6028_69_3,Books Binders Magazines & Newspapers,6028-69-03,:05,6028,69,3,
MAGAZINE,FLIP THROUGH PAGES,Magazine 6028_69_4,Books Binders Magazines & Newspapers,6028-69-04,:02,6028,69,4,
MAGAZINE,TOSS ON TABLE,Magazine 6028_69_5,Books Binders Magazines & Newspapers,6028-69-05,:02,6028,69,5,
MAIL BOX METAL,OPEN LID LETTER POST,MailBoxMetal 6021_20_1,Mailboxes & Mail Slots,6021-20-01,:02,6021,20,1,
MAIL BOX METAL,CLOSE LID LETTER POST,MailBoxMetal 6021_20_2,Mailboxes & Mail Slots,6021-20-02,:04,6021,20,2,
MAIL SLOT,MAIL SLOT IN DOOR: OPEN AND CLOSE LETTER POST,MailSlot 6021_20_3,Mailboxes & Mail Slots,6021-20-03,:02,6021,20,3,
MARSH DAY,CRICKETS BIRDS DUCKS INSECTS AMBIENCE SWAMP,MarshDay 6029_32,Forests Jungles & Swamps,6029-32-01,2:00,6029,32,1,
MARSH DAY,CRICKETS BIRDS AMBIENCE SWAMP,MarshDay 6029_33,Forests Jungles & Swamps,6029-33-01,2:00,6029,33,1,
MARSH NIGHT,CRICKETS FROGS AMBIENCE SWAMP,MarshNight 6029_34,Forests Jungles & Swamps,6029-34-01,2:00,6029,34,1,
MARSH NIGHT,FROGS CROAKING AT NIGHT AMBIENCE SWAMP ANIMAL AMPHIBIAN,MarshNight 6029_35,Forests Jungles & Swamps,6029-35-01,2:00,6029,35,1,
MATCH,SAFETY MATCH: STRIKE BURN SIZZLE FIRE,Match 6015_41_1,Fire Scenes Fires & Flames,6015-41-01,:10,6015,41,1,
MATCH,SAFETY MATCH: QUICK STRIKE BURN FIRE,Match 6015_41_2,Fire Scenes Fires & Flames,6015-41-02,:08,6015,41,2,
MATCH,SAFETY MATCH: SLOW STRIKE LIGHT AND BURN FIRE,Match 6015_42_1,Fire Scenes Fires & Flames,6015-42-01,:10,6015,42,1,
MATCH,SAFETY MATCH: SLOW STRIKE LIGHT AND BURN FIRE,Match 6015_42_2,Fire Scenes Fires & Flames,6015-42-02,:07,6015,42,2,
MATCH,SAFETY MATCH: QUICK STRIKE LIGHT AND BURN FIRE,Match 6015_42_3,Fire Scenes Fires & Flames,6015-42-03,:10,6015,42,3,
MATCH,SAFETY MATCH: QUICK STRIKE LIGHT AND BURN FIRE,Match 6015_42_4,Fire Scenes Fires & Flames,6015-42-04,:09,6015,42,4,
MATCH,WOODEN 'LIGHT ANYWHERE' MATCH: STRIKE AND BURN FIRE,Match 6015_43_1,Fire Scenes Fires & Flames,6015-43-01,:11,6015,43,1,
MATCH,WOODEN 'LIGHT ANYWHERE' MATCH: STRIKE AND BURN FIRE,Match 6015_43_2,Fire Scenes Fires & Flames,6015-43-02,:07,6015,43,2,
MATCH,FROM MATCH BOOK: STRIKE DOES NOT LIGHT FIRE,Match 6015_44_1,Fire Scenes Fires & Flames,6015-44-01,:02,6015,44,1,
MATCH,FROM MATCH BOOK: STRIKE AND LIGHT FIRE,Match 6015_44_2,Fire Scenes Fires & Flames,6015-44-02,:02,6015,44,2,
MATCH,FROM MATCH BOOK: STRIKE AND LIGHT FIRE,Match 6015_44_3,Fire Scenes Fires & Flames,6015-44-03,:02,6015,44,3,
MATCH,BLOWING MATCH OUT FIRE,Match 6015_45,Fire Scenes Fires & Flames,6015-45-01,:01,6015,45,1,
METAL FANTASY,RINGING METAL,MetalFantasy 6039_45_1,Magic Spells Fantasy Accents & Glisses,6039-45-01,:17,6039,45,1,
METAL FANTASY,RINGING METAL,MetalFantasy 6039_45_2,Magic Spells Fantasy Accents & Glisses,6039-45-02,1:00,6039,45,2,
METAL SQUEAK,LARGE SHIP LISTING,SqueakMetal 6040_38_1,Metal Foley;Squeak & Creak Foley;Miscellaneous Commercial Watercraft,6040-38-01,:04,6040,38,1,
METAL SQUEAK,LARGE SHIP LISTING,SqueakMetal 6040_38_2,Metal Foley;Squeak & Creak Foley;Miscellaneous Commercial Watercraft,6040-38-02,:06,6040,38,2,
METAL SQUEAK,LARGE SHIP LISTING,SqueakMetal 6040_38_3,Metal Foley;Squeak & Creak Foley;Miscellaneous Commercial Watercraft,6040-38-03,:07,6040,38,3,
METAL SQUEAK,METAL MOVEMENT AND SQUEAKS,SqueakMetal 6032_58_1,Metal Foley;Squeak & Creak Foley,6032-58-01,:26,6032,58,1,
METAL SQUEAK,METAL SCRAPES,SqueakMetal 6032_58_2,Metal Foley;Squeak & Creak Foley,6032-58-02,:25,6032,58,2,
METAL SQUEAL,METAL DRAGGING ON METAL,SqueakMetal 6040_39,Metal Foley;Squeak & Creak Foley,6040-39-01,:20,6040,39,1,
MICE,SMALL GROUP: SQUEAKING ANIMAL RODENT,AnimalMice 6003_89,Other Wild Animals,6003-89-01,:25,6003,89,1,
MICROPHONE,MICROPHONE: SINGLE TAP,Microphone 6032_59_1,Miscellaneous Entertainment,6032-59-01,:01,6032,59,1,
MICROPHONE,MICROPHONE: DOUBLE TAP,Microphone 6032_59_2,Miscellaneous Entertainment,6032-59-02,:01,6032,59,2,
MICROPHONE,MICROPHONE: SINGLE BLOW,Microphone 6032_59_3,Miscellaneous Entertainment,6032-59-03,:01,6032,59,3,
MICROPHONE,MICROPHONE: DOUBLE BLOW,Microphone 6032_59_4,Miscellaneous Entertainment,6032-59-04,:01,6032,59,4,
MICROWAVE OVEN,LARGE: OPEN DOOR,MicrowaveOven 6021_21_1,Small Household Appliances,6021-21-01,:01,6021,21,1,
MICROWAVE OVEN,LARGE: CLOSE DOOR,MicrowaveOven 6021_21_2,Small Household Appliances,6021-21-02,:05,6021,21,2,
MICROWAVE OVEN,LARGE: SINGLE BEEP,MicrowaveOven 6021_21_3,Beeps;Small Household Appliances,6021-21-03,:01,6021,21,3,
MICROWAVE OVEN,LARGE: START RUN STOP,MicrowaveOven 6021_21_4,Small Household Appliances,6021-21-04,1:06,6021,21,4,
MICROWAVE OVEN,SMALL: DOOR OPEN,MicrowaveOven 6021_22_1,Small Household Appliances,6021-22-01,:02,6021,22,1,
MICROWAVE OVEN,SMALL: DOOR CLOSE,MicrowaveOven 6021_22_2,Small Household Appliances,6021-22-02,:01,6021,22,2,
MICROWAVE OVEN,SMALL: SINGLE BEEP,MicrowaveOven 6021_22_3,Beeps;Small Household Appliances,6021-22-03,:01,6021,22,3,
MICROWAVE OVEN,SMALL: ON RUN STOP,MicrowaveOven 6021_22_4,Small Household Appliances,6021-22-04,1:06,6021,22,4,
MILLING MACHINE,ADJUST WORK SURFACE CONSTRUCTION,IndustryMillMachine 6012_95,Construction & Demolition Ambiences,6012-95-01,:58,6012,95,1,
MILLING MACHINE,SURFACE MILLING METAL STOCK CONSTRUCTION,IndustryMillMachine 6012_96,Construction & Demolition Ambiences,6012-96-01,1:06,6012,96,1,
MIXER FOOD PROCESSOR,OPEN LID BLENDER ELECTRIC,MixerFoodProcesso 6021_23_1,Small Household Appliances,6021-23-01,:02,6021,23,1,
MIXER FOOD PROCESSOR,CLOSE LID BLENDER ELECTRIC,MixerFoodProcesso 6021_23_2,Small Household Appliances,6021-23-02,:02,6021,23,2,
MIXER FOOD PROCESSOR,START MIX SHUT OFF BLENDER ELECTRIC,MixerFoodProcessor 6021_24,Small Household Appliances,6021-24-01,:31,6021,24,1,
MIXER FOOD PROCESSOR,SHORT PULSE BLENDER ELECTRIC,MixerFoodProcesso 6021_25_1,Small Household Appliances,6021-25-01,:01,6021,25,1,
MIXER FOOD PROCESSOR,SHORT PULSE BLENDER ELECTRIC,MixerFoodProcesso 6021_25_2,Small Household Appliances,6021-25-02,:01,6021,25,2,
MIXER FOOD PROCESSOR,LONG PULSE BLENDER ELECTRIC,MixerFoodProcesso 6021_25_3,Small Household Appliances,6021-25-03,:02,6021,25,3,
MIXER HAND,MANUAL: TURN HANDLE,MixerHand 6021_26_1,Small Household Appliances,6021-26-01,:24,6021,26,1,
MIXER HAND,MANUAL: MIX IN BOWL,MixerHand 6021_26_2,Small Household Appliances,6021-26-02,:30,6021,26,2,
MIXER HAND,OLD ELECTRIC: START RUN STOP LOW SPEED,MixerHand 6021_27_1,Small Household Appliances,6021-27-01,:32,6021,27,1,
MIXER HAND,OLD ELECTRIC: START RUN STOP HIGH SPEED,MixerHand 6021_27_2,Small Household Appliances,6021-27-02,:32,6021,27,2,
MIXER HAND,OLD ELECTRIC: MIX IN BOWL LOW SPEED,MixerHand 6021_28_1,Small Household Appliances,6021-28-01,:31,6021,28,1,
MIXER HAND,OLD ELECTRIC: MIX IN BOWL HIGH SPEED,MixerHand 6021_28_2,Small Household Appliances,6021-28-02,:32,6021,28,2,
MIXER HAND,ELECTRIC: START RUN STOP LOW SPEED,MixerHand 6021_29_1,Small Household Appliances,6021-29-01,:31,6021,29,1,
MIXER HAND,ELECTRIC: START RUN STOP HIGH SPEED,MixerHand 6021_29_2,Small Household Appliances,6021-29-02,:31,6021,29,2,
MIXER HAND,ELECTRIC: MIX IN BOWL LOW SPEED,MixerHand 6021_30_1,Small Household Appliances,6021-30-01,:30,6021,30,1,
MIXER HAND,ELECTRIC: MIX IN BOWL HIGH SPEED,MixerHand 6021_30_2,Small Household Appliances,6021-30-02,:31,6021,30,2,
MONKEY SPIDER,VOCAL ANIMAL APE,AnimalMonkeySpider 6003_90,Primates - Monkeys Chimps Apes,6003-90-01,:08,6003,90,1,
MORSE CODE,MORSE CODE: RECEIVE RADIO TELEGRAPH,MorseCode 6032_60_1,Radios,6032-60-01,:31,6032,60,1,
MORSE CODE,MORSE CODE: RECEIVE RADIO TELEGRAPH,MorseCode 6032_60_2,Radios,6032-60-02,:30,6032,60,2,
MORSE CODE,MORSE CODE: TRANSMIT RADIO TELEGRAPH,MorseCode 6032_60_3,Radios,6032-60-03,:15,6032,60,3,
MORTAR AND PESTLE,GRINDING SPICES WITH MORTAR AND PESTLE FOOD,MortarAndPestle 6021_31,Food,6021-31-01,:19,6021,31,1,
MOTOR BOAT,SPEEDBOAT MOTOR DRIVING,BoatSpeedboat 6038_66,Large Engine Motor Boats,6038-66-01,1:15,6038,66,1,
MOTOR COMICAL,SMALL ELECTRIC MOTOR: CLICKING COMEDY,ComedyMotor 6040_40,Engines Motors & Machines,6040-40-01,:30,6040,40,1,
MOTOR ELECTRIC,ELECTRIC INDUSTRIAL MOTOR,MotorElectric 6040_41_1,Engines Motors & Machines,6040-41-01,1:26,6040,41,1,
MOTOR ELECTRIC,ELECTRIC INDUSTRIAL MOTOR,MotorElectric 6040_41_2,Engines Motors & Machines,6040-41-02,1:13,6040,41,2,
MOTOR ELECTRIC,ELECTRIC INDUSTRIAL MOTOR,MotorElectric 6040_42,Engines Motors & Machines,6040-42-01,1:14,6040,42,1,
MOTOR ELECTRIC,ELECTRIC MOTOR: RUNNING INDUSTRY,MotorElectric 6032_61_1,Engines Motors & Machines,6032-61-01,1:00,6032,61,1,
MOTOR ELECTRIC,ELECTRIC MOTOR: START RUN STOP INDUSTRY,MotorElectric 6032_61_2,Engines Motors & Machines,6032-61-02,:36,6032,61,2,
MOTOR ELECTRIC,ELECTRIC MOTOR: START RUN STOP INDUSTRY,MotorElectric 6032_61_3,Engines Motors & Machines,6032-61-03,:09,6032,61,3,
MOTOR ELECTRIC,ELECTRIC MOTOR: START RUN STOP INDUSTRY,MotorElectric 6032_61_4,Engines Motors & Machines,6032-61-04,1:00,6032,61,4,
MOTOR PRINTER,NO TEXT COMPUTER PRINTER MOTOR,MotorPrinter 6038_53,Engines Motors & Machines,6038-53-01,:39,6038,53,1,
MOTOR SUBMARINE,SUBMARINE TURBO START MOTOR WIND UP INDUSTRY,BoatSubmarine 6038_60,Submarines,6038-60-01,:42,6038,60,1,
MOTOR SUBMARINE,SUBMARINE MOTOR START WIND DOWN INDUSTRY,BoatSubmarine 6038_61,Submarines,6038-61-01,:38,6038,61,1,
MOTOR SUBMARINE,SUBMARINE MOTOR START WIND DOWN INDUSTRY,BoatSubmarine 6038_62,Submarines,6038-62-01,:56,6038,62,1,
MOTOR WATER,MOTOR START UP AND WIND DOWN IN WATER,MotorWater 6038_63_1,Engines Motors & Machines,6038-63-01,:08,6038,63,1,
MOTOR WATER,MOTOR START UP AND WIND DOWN IN WATER,MotorWater 6038_63_2,Engines Motors & Machines,6038-63-02,:05,6038,63,2,
MOTOR WATER,MOTOR START UP AND WIND DOWN IN WATER,MotorWater 6038_63_3,Engines Motors & Machines,6038-63-03,:05,6038,63,3,
MOTOR WATER,MOTOR START UP AND WIND DOWN IN WATER,MotorWater 6038_63_4,Engines Motors & Machines,6038-63-04,:06,6038,63,4,
MOTOR WATER,MOTOR START UP AND WIND DOWN IN WATER,MotorWater 6038_64_1,Engines Motors & Machines,6038-64-01,:13,6038,64,1,
MOTOR WATER,MOTOR START UP AND WIND DOWN IN WATER,MotorWater 6038_64_2,Engines Motors & Machines,6038-64-02,:11,6038,64,2,
MOTOR WATER,MOTOR START UP AND WIND DOWN IN WATER,MotorWater 6038_64_3,Engines Motors & Machines,6038-64-03,:08,6038,64,3,
MOTOR WATER,MOTOR START UP AND WIND DOWN IN WATER,MotorWater 6038_64_4,Engines Motors & Machines,6038-64-04,:06,6038,64,4,
MOTOR WATER,MOTOR START UP TWO TIMES WIND DOWN IN WATER,MotorWater 6038_65_1,Engines Motors & Machines,6038-65-01,:05,6038,65,1,
MOTOR WATER,MOTOR START UP THREE TIMES WIND DOWN IN WATER,MotorWater 6038_65_2,Engines Motors & Machines,6038-65-02,:07,6038,65,2,
MOTOR WATER,MOTOR START UP THREE TIMES WIND DOWN IN WATER,MotorWater 6038_65_3,Engines Motors & Machines,6038-65-03,:05,6038,65,3,
MOTORCYCLE HARLEY,START IDLE SHUT OFF FROM SIDE,MotorcycleHarley 6026_58,Motorcycles & Scooters,6026-58-01,:42,6026,58,1,
MOTORCYCLE HARLEY,START IDLE SHUT OFF FROM REAR,MotorcycleHarley 6026_59,Motorcycles & Scooters,6026-59-01,:58,6026,59,1,
MOTORCYCLE HARLEY,START IDLE PULL AWAY SLOW SPEED EXIT RIGHT,MotorcycleHarley 6026_60,Motorcycles & Scooters,6026-60-01,:43,6026,60,1,
MOTORCYCLE HARLEY,START IDLE PULL AWAY FAST SPEED EXIT RIGHT,MotorcycleHarley 6026_61,Motorcycles & Scooters,6026-61-01,:37,6026,61,1,
MOTORCYCLE HARLEY,START IDLE PULL AWAY SLOW SPEED FROM REAR,MotorcycleHarley 6026_62,Motorcycles & Scooters,6026-62-01,:50,6026,62,1,
MOTORCYCLE HARLEY,START IDLE PULL AWAY FAST SPEED FROM REAR,MotorcycleHarley 6026_63,Motorcycles & Scooters,6026-63-01,:34,6026,63,1,
MOTORCYCLE HARLEY,PULL UP FROM LEFT SLOW SPEED STOP IDLE SHUT OFF,MotorcycleHarley 6026_64,Motorcycles & Scooters,6026-64-01,:44,6026,64,1,
MOTORCYCLE HARLEY,PULL UP FROM LEFT FAST SPEED STOP IDLE SHUT OFF,MotorcycleHarley 6026_65,Motorcycles & Scooters,6026-65-01,:34,6026,65,1,
MOTORCYCLE HARLEY,PULL UP HEAD ON SLOW SPEED STOP IDLE SHUT OFF,MotorcycleHarley 6026_66,Motorcycles & Scooters,6026-66-01,:51,6026,66,1,
MOTORCYCLE HARLEY,PULL UP HEAD ON FAST SPEED STOP IDLE SHUT OFF,MotorcycleHarley 6026_67,Motorcycles & Scooters,6026-67-01,:32,6026,67,1,
MOTORCYCLE HARLEY,START IDLE DRIVE AT SLOW SPEED,MotorcycleHarley 6026_68,Motorcycles & Scooters,6026-68-01,:57,6026,68,1,
MOTORCYCLE HARLEY,START IDLE DRIVE AT FAST SPEED,MotorcycleHarley 6026_69,Motorcycles & Scooters,6026-69-01,1:32,6026,69,1,
MOTORCYCLE HONDA 125,START IDLE SHUT OFF FROM SIDE,MotorcycleHonda125 6026_01,Motorcycles & Scooters,6026-01-01,:51,6026,1,1,
MOTORCYCLE HONDA 125,STATIONARY REVS; SHORT LONG GROUP OF FOUR SIDE,MotorcycleHonda125 6026_02,Motorcycles & Scooters,6026-02-01,:35,6026,2,1,
MOTORCYCLE HONDA 125,START IDLE PULL AWAY SLOW,MotorcycleHonda125 6026_03,Motorcycles & Scooters,6026-03-01,:18,6026,3,1,
MOTORCYCLE HONDA 125,START IDLE PULL AWAY MEDIUM SPEED,MotorcycleHonda125 6026_04,Motorcycles & Scooters,6026-04-01,:14,6026,4,1,
MOTORCYCLE HONDA 125,START IDLE PULL AWAY FAST SPEED,MotorcycleHonda125 6026_05,Motorcycles & Scooters,6026-05-01,:10,6026,5,1,
MOTORCYCLE HONDA 125,START IDLE DRIVE ON COURSE STOP SHUT OFF,MotorcycleHonda125 6026_06,Motorcycles & Scooters,6026-06-01,:58,6026,6,1,
MOTORCYCLE HONDA 125,PULL UP MEDIUM SPEED,MotorcycleHonda125 6026_07,Motorcycles & Scooters,6026-07-01,:18,6026,7,1,
MOTORCYCLE HONDA 125,PULL UP FAST SPEED STOP IDLE SHUT OFF,MotorcycleHonda125 6026_08,Motorcycles & Scooters,6026-08-01,:15,6026,8,1,
MOTORCYCLE HONDA 125,APPROACH PASS BY MEDIUM SPEED,MotorcycleHonda125 6026_09,Motorcycles & Scooters,6026-09-01,:13,6026,9,1,
MOTORCYCLE HONDA 125,APPROACH PASS BY FAST SPEED,MotorcycleHonda125 6026_10,Motorcycles & Scooters,6026-10-01,:13,6026,10,1,
MOTORCYCLE HONDA 125,APPROACH PASS BY VERY FAST SPEED,MotorcycleHonda125 6026_11,Motorcycles & Scooters,6026-11-01,:43,6026,11,1,
MOTORCYCLE HONDA 650,START IDLE SHUT OFF FROM SIDE,MotorcycleHonda650 6026_12,Motorcycles & Scooters,6026-12-01,:43,6026,12,1,
MOTORCYCLE HONDA 650,STATIONARY REVS; SHORT LONG GROUP OF FOUR SIDE,MotorcycleHonda650 6026_13,Motorcycles & Scooters,6026-13-01,:37,6026,13,1,
MOTORCYCLE HONDA 650,START IDLE PULL AWAY SLOW SPEED EXIT RIGHT,MotorcycleHonda650 6026_14,Motorcycles & Scooters,6026-14-01,:38,6026,14,1,
MOTORCYCLE HONDA 650,START IDLE PULL AWAY MEDIUM SPEED EXIT RIGHT,MotorcycleHonda650 6026_15,Motorcycles & Scooters,6026-15-01,:41,6026,15,1,
MOTORCYCLE HONDA 650,START IDLE PULL AWAY FAST SPEED EXIT RIGHT,MotorcycleHonda650 6026_16,Motorcycles & Scooters,6026-16-01,:34,6026,16,1,
MOTORCYCLE HONDA 650,START IDLE PULL AWAY VERY FAST SPEED EXIT RIGHT,MotorcycleHonda650 6026_17,Motorcycles & Scooters,6026-17-01,:20,6026,17,1,
MOTORCYCLE HONDA 650,START IDLE DRIVE STOP SHUT OFF,MotorcycleHonda650 6026_18,Motorcycles & Scooters,6026-18-01,1:25,6026,18,1,
MOTORCYCLE HONDA 650,PULL UP SLOW SPEED STOP IDLE SHUT OFF,MotorcycleHonda650 6026_19,Motorcycles & Scooters,6026-19-01,:27,6026,19,1,
MOTORCYCLE HONDA 650,PULL UP MEDIUM SPEED STOP IDLE SHUT OFF,MotorcycleHonda650 6026_20,Motorcycles & Scooters,6026-20-01,:24,6026,20,1,
MOTORCYCLE HONDA 650,PULL UP FAST SPEED STOP IDLE SHUT OFF,MotorcycleHonda650 6026_21,Motorcycles & Scooters,6026-21-01,:29,6026,21,1,
MOTORCYCLE HONDA 650,APPROACH PASS BY SLOW SPEED,MotorcycleHonda650 6026_22,Motorcycles & Scooters,6026-22-01,:46,6026,22,1,
MOTORCYCLE HONDA 650,APPROACH PASS BY MEDIUM SPEED,MotorcycleHonda650 6026_23,Motorcycles & Scooters,6026-23-01,:37,6026,23,1,
MOTORCYCLE HONDA 650,APPROACH PASS BY FAST SPEED,MotorcycleHonda650 6026_24,Motorcycles & Scooters,6026-24-01,:31,6026,24,1,
MOTORCYCLE MOTOCROSS,TIRE BURN OUT,MotorcycleMotocross 6026_92,Motorcycles & Scooters,6026-92-01,:16,6026,92,1,
MOTORCYCLE MOTOCROSS,START OF RACE,MotorcycleMotocross 6026_93,Motorcycles & Scooters,6026-93-01,1:21,6026,93,1,
MOTORCYCLE MOTOCROSS,START OF RACE,MotorcycleMotocross 6026_94,Motorcycles & Scooters,6026-94-01,:19,6026,94,1,
MOTORCYCLE MOTOCROSS,PASS BYS MANY BIKES,MotorcycleMotocross 6026_95,Motorcycles & Scooters,6026-95-01,:25,6026,95,1,
MOTORCYCLE RACE,SINGLE BIKE FAST PASS BY,MotorcycleRace 6038_67,Motorcycles & Scooters,6038-67-01,:20,6038,67,1,
MOTORCYCLE RACE,SINGLE BIKE FAST PASS BY,MotorcycleRace 6038_68,Motorcycles & Scooters,6038-68-01,:19,6038,68,1,
MOTORCYCLE RACE 250,SINGLE PASS BY,MotorcycleRace250 6026_70_1,Motorcycles & Scooters,6026-70-01,:06,6026,70,1,
MOTORCYCLE RACE 250,SINGLE PASS BY P.A. ANNOUNCEMENT IN BACKGROUND,MotorcycleRace250 6026_70_2,Motorcycles & Scooters,6026-70-02,:08,6026,70,2,
MOTORCYCLE RACE 250,SINGLE PASS BY P.A. ANNOUNCEMENT IN BACKGROUND,MotorcycleRace250 6026_70_3,Motorcycles & Scooters,6026-70-03,:08,6026,70,3,
MOTORCYCLE RACE 250,TWO BIKES PASS BY,MotorcycleRace250 6026_71_1,Motorcycles & Scooters,6026-71-01,:11,6026,71,1,
MOTORCYCLE RACE 250,TWO BIKES PASS BY CLOSELY SPACED SCI FI,MotorcycleRace250 6026_71_2,Space Fly Bys & Rockets,6026-71-02,:08,6026,71,2,
MOTORCYCLE RACE 250,TWO BIKES PASS BY CLOSELY SPACED SCI FI,MotorcycleRace250 6026_72_1,Space Fly Bys & Rockets,6026-72-01,:10,6026,72,1,
MOTORCYCLE RACE 250,TWO BIKES PASS BY CLOSELY SPACED SCI FI,MotorcycleRace250 6026_72_2,Space Fly Bys & Rockets,6026-72-02,:11,6026,72,2,
MOTORCYCLE RACE 250,MANY BIKES PASS BY CLOSELY SPACED SCI FI,MotorcycleRace250 6026_73_1,Space Fly Bys & Rockets,6026-73-01,:18,6026,73,1,
MOTORCYCLE RACE 250,MANY BIKES PASS BY SPACED APART SCI FI,MotorcycleRace250 6026_73_2,Space Fly Bys & Rockets,6026-73-02,:21,6026,73,2,
MOTORCYCLE RACE 250,SMALL GROUP MOVING AROUND CORNER,MotorcycleRace250 6026_74_1,Motorcycles & Scooters,6026-74-01,:16,6026,74,1,
MOTORCYCLE RACE 250,LARGE GROUP MOVING AROUND CORNER,MotorcycleRace250 6026_74_2,Motorcycles & Scooters,6026-74-02,:13,6026,74,2,
MOTORCYCLE RACE 250,SINGLE BIKE OUT OF CORNER PASS BY,MotorcycleRace250 6026_75_1,Motorcycles & Scooters,6026-75-01,:08,6026,75,1,
MOTORCYCLE RACE 250,LARGE GROUP OUT OF CORNER PASS BY CLOSELY SPACED SCI FI,MotorcycleRace250 6026_75_2,Space Fly Bys & Rockets,6026-75-02,:17,6026,75,2,
MOTORCYCLE RACE 250,LARGE GROUP OUT OF CORNER PASS BY SPACED APART SCI FI,MotorcycleRace250 6026_75_3,Space Fly Bys & Rockets,6026-75-03,:25,6026,75,3,
MOTORCYCLE RACE 250,FINISH LINE LARGE GROUPS PASS BY SLOW DOWN,MotorcycleRace250 6026_76,Motorcycles & Scooters,6026-76-01,:31,6026,76,1,
MOTORCYCLE RACE 750,START OF RACE IDLE REVS BEGIN RACE,MotorcycleRace750 6026_77_1,Motorcycles & Scooters,6026-77-01,:37,6026,77,1,
MOTORCYCLE RACE 750,START OF RACE REVS RACE P.A. IN BACKGROUND,MotorcycleRace750 6026_77_2,Motorcycles & Scooters,6026-77-02,1:15,6026,77,2,
MOTORCYCLE RACE 750,SINGLE BIKE PASS BY,MotorcycleRace750 6026_78,Motorcycles & Scooters,6026-78-01,:12,6026,78,1,
MOTORCYCLE RACE 750,LARGE GROUP INTO CORNER CLOSELY SPACED SCI FI,MotorcycleRace750 6026_79_1,Space Fly Bys & Rockets,6026-79-01,:26,6026,79,1,
MOTORCYCLE RACE 750,LARGE GROUP PASS BY INTO CORNER CLOSELY SPACED SCI FI,MotorcycleRace750 6026_79_2,Space Fly Bys & Rockets,6026-79-02,:32,6026,79,2,
MOTORCYCLE RACE 750,LARGE GROUP OUT OF CORNER PASS BY CLOSELY SPACED SCI FI,MotorcycleRace750 6026_80_1,Space Fly Bys & Rockets,6026-80-01,:29,6026,80,1,
MOTORCYCLE RACE 750,LARGE GROUP OUT OF CORNER PASS BY SPACED APART SCI FI,MotorcycleRace750 6026_80_2,Space Fly Bys & Rockets,6026-80-02,:38,6026,80,2,
MOTORCYCLE RACE 750,PRACTICE AMBIENCE PASS BYS INTO CORNER,MotorcycleRace750 6026_81,Motorcycles & Scooters,6026-81-01,1:41,6026,81,1,
MOTORCYCLE RACE DRAG,TIRE BURN OUT P.A. ANNOUNCEMENT IN BACKGROUND,MotorcycleRaceDra 6026_82_1,Motorcycles & Scooters,6026-82-01,:06,6026,82,1,
MOTORCYCLE RACE DRAG,TIRE BURN OUT P.A. ANNOUNCEMENT IN BACKGROUND,MotorcycleRaceDra 6026_82_2,Motorcycles & Scooters,6026-82-02,:05,6026,82,2,
MOTORCYCLE RACE DRAG,SINGLE BIKE RACE AWAY,MotorcycleRaceDrag 6026_83,Motorcycles & Scooters,6026-83-01,:09,6026,83,1,
MOTORCYCLE RACE DRAG,SINGLE BIKE PASS BY,MotorcycleRaceDra 6026_84_1,Motorcycles & Scooters,6026-84-01,:12,6026,84,1,
MOTORCYCLE RACE DRAG,SINGLE BIKE PASS BY,MotorcycleRaceDra 6026_84_2,Motorcycles & Scooters,6026-84-02,:15,6026,84,2,
MOTORCYCLE RACE DRAG,BEGIN RACE P.A. ANNOUNCEMENT IN BACKGROUND,MotorcycleRaceDrag 6026_85,Motorcycles & Scooters,6026-85-01,:14,6026,85,1,
MOTORCYCLE RACE DRAG,BEGIN RACE REVS RACE AWAY P.A. IN BACKGROUND,MotorcycleRaceDra 6026_86_1,Motorcycles & Scooters,6026-86-01,:37,6026,86,1,
MOTORCYCLE RACE DRAG,BEGIN RACE REVS RACE AWAY P.A. IN BACKGROUND,MotorcycleRaceDra 6026_86_2,Motorcycles & Scooters,6026-86-02,:16,6026,86,2,
MOTORCYCLE RACE DRAG,BEGIN RACE REVS RACE AWAY P.A. IN BACKGROUND,MotorcycleRaceDra 6026_86_3,Motorcycles & Scooters,6026-86-03,:30,6026,86,3,
MOTORCYCLE RACE DRAG,BEGIN RACE REVS RACE AWAY P.A. IN BACKGROUND,MotorcycleRaceDra 6026_87_1,Motorcycles & Scooters,6026-87-01,:14,6026,87,1,
MOTORCYCLE RACE DRAG,BEGIN RACE REVS RACE AWAY P.A. IN BACKGROUND,MotorcycleRaceDra 6026_87_2,Motorcycles & Scooters,6026-87-02,:20,6026,87,2,
MOTORCYCLE RACE DRAG,BEGIN RACE REVS RACE AWAY P.A. IN BACKGROUND,MotorcycleRaceDra 6026_87_3,Motorcycles & Scooters,6026-87-03,:22,6026,87,3,
MOTORCYCLE RACE DRAG,BEGIN RACE REVS RACE AWAY P.A. IN BACKGROUND,MotorcycleRaceDra 6026_87_4,Motorcycles & Scooters,6026-87-04,:18,6026,87,4,
MOTORCYCLE RACE DRAG,BEGIN RACE; APPROACH PASS BY,MotorcycleRaceDra 6026_88_1,Motorcycles & Scooters,6026-88-01,:11,6026,88,1,
MOTORCYCLE RACE DRAG,BEGIN RACE; APPROACH PASS BY,MotorcycleRaceDra 6026_88_2,Motorcycles & Scooters,6026-88-02,:15,6026,88,2,
MOTORCYCLE RACE DRAG,BEGIN RACE; APPROACH PASS BY,MotorcycleRaceDra 6026_89_1,Motorcycles & Scooters,6026-89-01,:19,6026,89,1,
MOTORCYCLE RACE DRAG,BEGIN RACE; APPROACH PASS BY,MotorcycleRaceDra 6026_89_2,Motorcycles & Scooters,6026-89-02,:12,6026,89,2,
MOTORCYCLE RACE DRAG,FINISH LINE; PASS BY SLOW DOWN,MotorcycleRaceDra 6026_90_1,Motorcycles & Scooters,6026-90-01,:11,6026,90,1,
MOTORCYCLE RACE DRAG,FINISH LINE; PASS BY SLOW DOWN,MotorcycleRaceDra 6026_90_2,Motorcycles & Scooters,6026-90-02,:10,6026,90,2,
MOTORCYCLE RACE DRAG,FINISH LINE; PASS BY SLOW DOWN,MotorcycleRaceDra 6026_91_1,Motorcycles & Scooters,6026-91-01,:10,6026,91,1,
MOTORCYCLE RACE DRAG,FINISH LINE; PASS BY SLOW DOWN,MotorcycleRaceDra 6026_91_2,Motorcycles & Scooters,6026-91-02,:08,6026,91,2,
MOTORCYCLE RACE DRAG,FINISH LINE; PASS BY SLOW DOWN,MotorcycleRaceDra 6026_91_3,Motorcycles & Scooters,6026-91-03,:12,6026,91,3,
MOTORCYCLE SUZUKI 1100,START IDLE SHUT OFF FROM SIDE SUZUKI,MotorcycleSuz1100 6026_25,Motorcycles & Scooters,6026-25-01,1:10,6026,25,1,
